382736542936367104,Wed Sep 25 052117 +0000 2013|Well Why Runners Don’t Get Knee Arthritis http//nytims/14FwliM
382713926871678976,Wed Sep 25 035125 +0000 2013|Hits to Head Don’t Differ With Age Research Shows  http//nytims/14Fs8vI
382713925512744960,Wed Sep 25 035124 +0000 2013|Rules Sought for Workplace Wellness Questionnaires http//nytims/181d9fY
382635940793307136,Tue Sep 24 224131 +0000 2013|Well Pregnant Weight Lifter Stirs Debate http//nytims/19xpasP
382611069232873473,Tue Sep 24 210242 +0000 2013|Feeling queasy reading this New thoughts on what causes motion sickness http//nytims/15pFEWR
382608552537227264,Tue Sep 24 205242 +0000 2013|Who lives longer married or unmarried cancer patients http//nytims/15qBk9J
382550167229980672,Tue Sep 24 170041 +0000 2013|Bringing up the subject of fertility at the time of cancer diagnosis in children http//nytims/15pFe2s
382550069247217664,Tue Sep 24 170018 +0000 2013|Well Married Cancer Patients Live Longer http//nytims/16wI1B2
382359868172410880,Tue Sep 24 042431 +0000 2013|World Briefing , Health and Science Global Spending to Fight AIDS Has Grown Slowly Report Finds http//nytims/16ndZXj
382356044640706560,Tue Sep 24 040919 +0000 2013|Burger King Introducing a LowerFat French Fry http//nytims/18TKJBm
382356043013300224,Tue Sep 24 040919 +0000 2013|FDA to Regulate Only Some Health Apps http//nytims/16ndZXh
382263494231732224,Mon Sep 23 220133 +0000 2013|Books ‘Knocking on Heaven’s Door’ — a Daughter’s Tale of Caring for her Parents http//nytims/15mXDaV
382263491748704256,Mon Sep 23 220133 +0000 2013|Gene Therapy With a Difference http//nytims/18QhTbf
382256369341980672,Mon Sep 23 213315 +0000 2013|Is Billy a 12yearold with Duchenne muscular dystrophy being helped by an experimental drug http//nytims/15PRWGn
382244468596154368,Mon Sep 23 204557 +0000 2013|Global Health Arsenic Contamination Threatens Water in Hanoi http//nytims/18QaM2g
382244466956193792,Mon Sep 23 204557 +0000 2013|Well Rethinking Motion Sickness http//nytims/15mVYSL
382237759869841408,Mon Sep 23 201918 +0000 2013|Well After Childhood Cancer Fertility Is Within Reach for Many http//nytims/18Q734R
382228503740964864,Mon Sep 23 194231 +0000 2013|RT cslnyt Want a hospital w/ fewer medical errors or one w/ hotel perks nytrosenthal  http//nytims/15dl5Hy
382191471274647552,Mon Sep 23 171522 +0000 2013|RT paulaspan Perennial question Who makes end of life decisions for incapacitated seniors who have no family Some solutions http//t…
382186808186273792,Mon Sep 23 165650 +0000 2013|The New Old Age Blog When There’s No Family http//nytims/17XhfWq
382186806311415808,Mon Sep 23 165649 +0000 2013|Recipes for Health Easing Into Fall Taking Eggplant With You http//nytims/18PzGPN
382166840061210625,Mon Sep 23 153729 +0000 2013|Well Scans More Likely if Doctors Have Financial Stake http//nytims/17X5S0K
382001421060960256,Mon Sep 23 044010 +0000 2013|Robert McCabe Jr a Kidney Donation Specialist Dies at 88 http//nytims/16s4uPL
382001418032668672,Mon Sep 23 044009 +0000 2013|Lower Health Insurance Premiums to Come at Cost of Fewer Choices http//nytims/1bAuXT8
381997595633397760,Mon Sep 23 042458 +0000 2013|Well Dietary Report Card Disappoints http//nytims/16s3Rps
381595869159899137,Sun Sep 22 014839 +0000 2013|Once Suicidal and Shipped Off Now Fighting Nevada Over Care http//nytims/18KMbvV
381591990737330176,Sun Sep 22 013314 +0000 2013|Alan Berliner’s ‘First Cousin Once Removed’ http//nytims/18KMbvX
381591989353218049,Sun Sep 22 013314 +0000 2013|Ad Campaigns Compete as Health Law Rollout Looms http//nytims/19p0BOu
381588190454628352,Sun Sep 22 011808 +0000 2013|Quandary of Hidden Disabilities Conceal or Reveal http//nytims/19oZlLo
381440923307347968,Sat Sep 21 153257 +0000 2013|John Kennell Advocate of Infant Bonding Dies at 91 http//nytims/1bxRIah
381265670576799744,Sat Sep 21 035634 +0000 2013|Business Briefing , Regulatory News FDA to Require Tracking Codes in Medical Devices http//nytims/15cSXK5
381122132669120512,Fri Sep 20 182611 +0000 2013|Well Cooking With Miso http//nytims/16Mlzbo
381122130794250240,Fri Sep 20 182611 +0000 2013|Well The Arsenic in Our Drinking Water http//nytims/16lpp76
380912194894192640,Fri Sep 20 043158 +0000 2013|Well Ask Well Sleep or Exercise http//nytims/1gFZzjL
380908319202103296,Fri Sep 20 041634 +0000 2013|Minnesota Goalie Helps Others With Multiple Sclerosis http//nytims/14oxHOY
380844691270692864,Fri Sep 20 000344 +0000 2013|Magazine Into the Wildfire http//nytims/1aXeSaH
380844689634910208,Fri Sep 20 000344 +0000 2013|Candace Pert 67 Explorer of the Brain Dies http//nytims/1aPa4AC
380803833997565952,Thu Sep 19 212123 +0000 2013|The New Old Age Blog No Easy Answers on Financing LongTerm Care http//nytims/1aOP0u9
380790516822310913,Thu Sep 19 202828 +0000 2013|Well Questioning Steroid Shots for Back Pain http//nytims/1aOFkzQ
380725389259456512,Thu Sep 19 160940 +0000 2013|Well Magnets Fail to Relieve Arthritis Pain http//nytims/1dsxKvE
380708068067409920,Thu Sep 19 150051 +0000 2013|Signs May Be Evident in Hindsight but Predicting Violent Behavior Is Tough http//nytims/1esbi8Z
380661289775026176,Thu Sep 19 115458 +0000 2013|New Study Lends Conclusive Support to a Scoliosis Treatment http//nytims/16pOnmC
380651968999718912,Thu Sep 19 111756 +0000 2013|Well Medicine Is More Than Carrots and Sticks http//nytims/1a6v9pp
380568790406553600,Thu Sep 19 054724 +0000 2013|US Warns of Frauds Tied to Health Care Law http//nytims/1eSFzyX
380564901665964032,Thu Sep 19 053157 +0000 2013|OpEd Contributor Bring Back the Lyme Vaccine http//nytims/1gBeLi5
380564900181209088,Thu Sep 19 053157 +0000 2013|Stephen E Malawista Lyme Disease Researcher Dies at 79 http//nytims/1eSFACQ
380561025348931584,Thu Sep 19 051633 +0000 2013|Mental Health Again an Issue in Gun Debate http//nytims/1gBeImG
380561023079817216,Thu Sep 19 051633 +0000 2013|Well What a Messy Desk Says About You http//nytims/1eSIYhk
380499410339516416,Thu Sep 19 011143 +0000 2013|Your Money Adviser Businesses Manage Medical Bill Payment Plans http//nytims/18AvflM
380499407688712192,Thu Sep 19 011142 +0000 2013|AntiHunger Advocates Put Pressure on Lawmakers Over Food Stamp Bill http//nytims/18aurYJ
380456647749304320,Wed Sep 18 222148 +0000 2013|After Uproar Penn State Suspends Penalty Fee in Wellness Plan http//nytims/14k5Z5Z
380380059820765184,Wed Sep 18 171728 +0000 2013|More evidence that recess leads to school success  http//nytims/19eRfDH
380355863963516928,Wed Sep 18 154119 +0000 2013|33 Million Grant for Effort to Prevent EarlyOnset Alzheimer’s http//nytims/1eQh2KV
380355690193104896,Wed Sep 18 154037 +0000 2013| PamBelluck writes about 33 million worth of hope for Alzheimers prevention http//nytims/19eXHKT
380342165387628545,Wed Sep 18 144653 +0000 2013|Ask an Expert Taking Questions on Causes and Effects of Sleep Deficiency http//nytims/1eQ2j2z
380341840165097472,Wed Sep 18 144535 +0000 2013|RT paulaspan In eldercare biology still destiny Daughters (mostly) take care of aging mothers Cue Shirelles Baby its you http//t…
380274040168267776,Wed Sep 18 101610 +0000 2013|The New Old Age Blog Daughters (Still) Are the Caregivers http//nytims/1doduLF
380183917745438720,Wed Sep 18 041804 +0000 2013|Well How Physical Fitness May Promote School Success http//nytims/168xG51
380171947109527552,Wed Sep 18 033030 +0000 2013|Florida Among States Undercutting Health Care Enrollment http//nytims/1bqe4KJ
380171944219639808,Wed Sep 18 033029 +0000 2013|Percentage of Americans Lacking Health Coverage Falls Again http//nytims/16jDiDC
380073355086270464,Tue Sep 17 205843 +0000 2013|RT PerriKlass So it seems a little like a contradiction in terms to tweet about my shyness articlebut check it out http//tco/DbWXOGM…
380073285922222080,Tue Sep 17 205827 +0000 2013|RT taraparkerpope Help us build an online community that tells the stories of those touched by breast cancer Share your story http//t…
380018165020766208,Tue Sep 17 171925 +0000 2013|When can a fetus feel pain The science is murky http//nytims/1aHVzPb
380010113961971714,Tue Sep 17 164726 +0000 2013|What causes one child to be shy and another outgoing PerriKlass offers tips for helping shy children open up http//nytims/1aI7MTK
380004324304117760,Tue Sep 17 162425 +0000 2013|Enjoying inflicting pain without provocation You too may be an “everyday sadist” http//nytims/1aHW6k9
379987983916875776,Tue Sep 17 151929 +0000 2013|My Story Inspired by Denise http//nytims/188SaGR
379818784351326208,Tue Sep 17 040709 +0000 2013|US Bans Import of Generic Drugs From Indian Plant http//nytims/1eYbHi5
379818782447128576,Tue Sep 17 040709 +0000 2013|Initial Focus of Research in Brain Project Is Chosen http//nytims/17FrQoO
379814993711353856,Tue Sep 17 035205 +0000 2013|Complex Science at Issue in Politics of Fetal Pain http//nytims/17FrOx4
379814991605411841,Tue Sep 17 035205 +0000 2013|Hoping to Raise Awareness 2 Leading Groups for the Blind Plan a Merger http//nytims/17FrQF6
379724269196152832,Mon Sep 16 215135 +0000 2013|Letters Testing Penicillin Allergies http//nytims/1ejpQYv
379724265496780800,Mon Sep 16 215134 +0000 2013|New Hope for HIV Vaccine http//nytims/1ejr4mB
379716793700732929,Mon Sep 16 212153 +0000 2013|Global Health United States Ranks 11th in Plague Cases Worldwide http//nytims/1ejkyfH
379712954016755712,Mon Sep 16 210637 +0000 2013|Well ‘Everyday Sadists’ Among Us http//nytims/1ejjCYD
379681225893773312,Mon Sep 16 190033 +0000 2013|Well To Help a Shy Child Listen http//nytims/1djgWHk
379657315659825152,Mon Sep 16 172532 +0000 2013|CDC Report Finds 23000 Deaths a Year From AntibioticResistant Infections http//nytims/14Wb3jq
379649227359412224,Mon Sep 16 165324 +0000 2013|Giants fans Still mourning the miserable loss to Peyton Watch what you eat today it may be fattier than usual http//nytims/15xFf2E
379626116161761280,Mon Sep 16 152133 +0000 2013|Well Behavior Therapy Aids ObsessiveCompulsive Disorder http//nytims/14VMLpv
379619535495520256,Mon Sep 16 145524 +0000 2013|Good news Teenagers are exercising more consuming less sugar and eating more fruits and vegetables http//nytims/15xFHOm
379618792646537216,Mon Sep 16 145227 +0000 2013|Did you favorite football team lose this week Watch what you eat todayit may be fattier than usual http//nytims/15xFf2E
379595326124216320,Mon Sep 16 131912 +0000 2013|Well When Parents Need Nurturing http//nytims/18rdjjl
379459530239008768,Mon Sep 16 041936 +0000 2013|Well Teenagers Are Getting More Exercise and Vegetables http//nytims/147Rimr
379459528611614720,Mon Sep 16 041936 +0000 2013|Well When Teams Lose Fans Turn to Fatty Food http//nytims/19W5EH2
379062920694734848,Sun Sep 15 020337 +0000 2013|Stephen Crohn Who Furthered AIDS Study Dies at 66 http//nytims/14R6FSE
379062919310626816,Sun Sep 15 020337 +0000 2013|Technophoria On Campus a Faculty Uprising Over Personal Data http//nytims/14R6FSC
378736653441187840,Sat Sep 14 042709 +0000 2013|Girl’s Suicide Increases Worry as Bullies Use New Web Sites http//nytims/14Tpqj1
378732732698083328,Sat Sep 14 041134 +0000 2013|Fraud Investigation Unsettles Mental Health Care in New Mexico http//nytims/15Z3DwF
378732731070681088,Sat Sep 14 041134 +0000 2013|The New Old Age Blog Ideas of Federal Panel on LongTerm Care Don’t Cover Costs http//nytims/15Z3DwH
378607180918046720,Fri Sep 13 195240 +0000 2013|Well Quick Breads Packed With Flavor http//nytims/1gbxm4e
378603315690356736,Fri Sep 13 193719 +0000 2013|Drinking milk in pregnancy may lead to taller children http//nytims/15pCpfX
378527356211953664,Fri Sep 13 143529 +0000 2013|Well When Nurses Bond With Their Patients http//nytims/1eLjYWs
378505963051167745,Fri Sep 13 131028 +0000 2013|Well Drinking Milk in Pregnancy May Lead to Taller Children http//nytims/1eL5HcB
378364213561135104,Fri Sep 13 034712 +0000 2013|FDA Panel Backs PreSurgery Drug for Breast Cancer http//nytims/18h6PDy
378364211673726976,Fri Sep 13 034712 +0000 2013|New Recalls by Johnson amp Johnson Raise Concern About Quality Control Improvements http//nytims/18h6PDC
378311629647015937,Fri Sep 13 001815 +0000 2013|How well do you do know health news Test yourself with our weekly health quiz  http//nytims/15nVfEk
378241808377339905,Thu Sep 12 194049 +0000 2013|The New Old Age Blog A Family Says ‘Enough’ http//nytims/18TXbDj
378213624009203712,Thu Sep 12 174849 +0000 2013|Well Living With Cancer A Rainbow Coalition http//nytims/18TEHTf
378202919012950016,Thu Sep 12 170617 +0000 2013|Well Caring for a Mind in Crisis http//nytims/18TxylR
378167941537087488,Thu Sep 12 144717 +0000 2013|Mind the gap the gap tooth that is http//nytims/15n3dNZ
378011839311130624,Thu Sep 12 042700 +0000 2013|Well Ask Well Gap Toothed http//nytims/1ekd7FO
378007852285444096,Thu Sep 12 041109 +0000 2013|Unions’ Misgivings on Health Law Burst Into View http//nytims/1ekaiVe
378007849986961408,Thu Sep 12 041109 +0000 2013|OpEd Contributors Selling the Fantasy of Fertility http//nytims/1ekaiVi
377974805536182272,Thu Sep 12 015950 +0000 2013|Free Apps for Nearly Every Health Problem but What About Privacy http//nytims/19JolO5
377947711729041408,Thu Sep 12 001211 +0000 2013|Camels Linked to Spread of Fatal Virus http//nytims/19J6k2z
377914836770119683,Wed Sep 11 220133 +0000 2013|MiddleAged Men Can Blame Estrogen Too http//nytims/181IzPP
377888340915527680,Wed Sep 11 201615 +0000 2013|I don’t need a MedicAlert pendant yet Until I do the city will be fun After I do it’ll be necessary http//nytims/15kH2rR
377887502419636224,Wed Sep 11 201256 +0000 2013|RT cslnyt Did you know lactation support for breastfeeding moms is mandated under ACA http//bitly/1aqPYwt
377887480437297152,Wed Sep 11 201250 +0000 2013|RT bstrauch Can bursts of exercise make us eat lesshttp//nytims/15W7zHA
377876501552971776,Wed Sep 11 192913 +0000 2013|Whats the est exercise to curb your appetite GretchenReynold reports http//nytims/17q7ZtB
377843010559823872,Wed Sep 11 171608 +0000 2013|Well How Exercise Can Help Us Eat Less http//nytims/17XUEp2
377838324448501761,Wed Sep 11 165731 +0000 2013|Answers Sought for When Marijuana Laws Collide http//nytims/17XWGFP
377838322317811712,Wed Sep 11 165730 +0000 2013|Well Futile Care at Life’s End http//nytims/1d5GRCe
377829109159976960,Wed Sep 11 162054 +0000 2013|GotNext Thanks for responding to the NYTimes tweet about football and food Can you email me karenbarrownytimescom
377634249597534208,Wed Sep 11 032635 +0000 2013|The New Old Age Blog Getting While the Getting Is Good http//nytims/1edjURG
377630466763157504,Wed Sep 11 031133 +0000 2013|My Story Bad Dog http//nytims/1edrHyU
377630465106378754,Wed Sep 11 031133 +0000 2013|FDA Announces Changes to Labeling of Some Prescription Painkillers http//nytims/1ee9ql9
377546066549170176,Tue Sep 10 213611 +0000 2013|Is breakfast really the most important meal of the day http//nytims/18RT4pX
377536037439811584,Tue Sep 10 205620 +0000 2013|nyvinnie can you email me (a nytimes editor) karenbarrownytimescom We have some followup questions about your postloss meal
377515206525480962,Tue Sep 10 193333 +0000 2013|RT bstrauch Think you are allergic to penicillin Well maybe nothttp//nytims/1axpH2Z
377504359866568705,Tue Sep 10 185027 +0000 2013|NYTs Donald G McNeil Jr is looking to talk to gay men who use PrEP instead of (or with) condoms Please contact him at mcneilnytimescom
377476234550059009,Tue Sep 10 165842 +0000 2013|brewcitypaul Thanks for responding to the NYTimes tweet about football and food Can you DM us with contact info
377455775100055552,Tue Sep 10 153724 +0000 2013|Those graphic antismoking ads seem to be helping  http//nytims/18RT9Kq
377452012004442112,Tue Sep 10 152227 +0000 2013|Civil Behavior ‘Coming Out’ About HIV and Facing Down the Stigma http//nytims/1edgzlK
377403085079199744,Tue Sep 10 120801 +0000 2013|Well Graphic Ads Motivate Smokers to Quit http//nytims/19DAvbp
377373433719312384,Tue Sep 10 101012 +0000 2013|Well Myths Surround Breakfast and Weight http//nytims/1fU8j5y
377317162006089728,Tue Sep 10 062636 +0000 2013|Recipes for Health Savory Oatmeal Pan Bread http//nytims/1ayn4xU
377215244445437952,Mon Sep 09 234137 +0000 2013|Stem Cell Treatments Overtake Science http//nytims/18JLPBx
377215242977439744,Mon Sep 09 234136 +0000 2013|The Consumer New Concerns on Robotic Surgeries http//nytims/18JXxMA
377211459463573504,Mon Sep 09 232634 +0000 2013|World Briefing , Middle East Polio Virus Found in Jerusalem’s Sewers http//nytims/18K9D8s
377211456821157888,Mon Sep 09 232634 +0000 2013|Improving Respirator Masks to Put Fresh Air in Reach http//nytims/1dWu9Jc
377159896313380864,Mon Sep 09 200141 +0000 2013|Hard Cases Penicillin Allergies Overblown http//nytims/1dW7QDe
377148537051815936,Mon Sep 09 191632 +0000 2013|Global Health Diabetes Epidemic Grows in China http//nytims/1dW3goA
377113956583608320,Mon Sep 09 165908 +0000 2013|Calling all football fans Can you help our reporter Did your team win or lose yesterday And what have you eaten so far today
377113304449445888,Mon Sep 09 165632 +0000 2013|Well Looking for Ways to Save Heart Attack Victims http//nytims/1e9mqIy
377107920250351617,Mon Sep 09 163509 +0000 2013|Giants fans can you help a reporter What did you eat so far today
377098216128675840,Mon Sep 09 155635 +0000 2013|Recipes for Health Quick Breads That Are Sweet Savory and Whole Wheat http//nytims/18PkPQ5
377073413040660480,Mon Sep 09 141802 +0000 2013|Lasker Awards Go to Five Scientists and Gateses http//nytims/1e8QXq2
376924038675050496,Mon Sep 09 042428 +0000 2013|Well Life’s Hard Lessons http//nytims/1dUfk9O
376917416267485184,Mon Sep 09 035809 +0000 2013|Inquiry Finds Inadequate Staffing at Mississippi Veterans Hospital http//nytims/1fOCc7f
376753782585315329,Sun Sep 08 170756 +0000 2013|Drug Cocktail Used to Treat MERS in Monkeys May Aid Humans http//nytims/15GNndy
376532040252157952,Sun Sep 08 022648 +0000 2013|Mobility Giving Mobility When Legs Can’t http//nytims/15FgXQt
376228885148758016,Sat Sep 07 062210 +0000 2013|Fitness Rowing Revives in the Gym http//nytims/17Hfid2
376228883244548096,Sat Sep 07 062210 +0000 2013|Insurance Rolls to Rise in State Fighting Plan http//nytims/17XnKLc
376225010857562112,Sat Sep 07 060647 +0000 2013|FDA Approves a Drug for LateStage Pancreatic Cancer http//nytims/17HficU
376225009221791744,Sat Sep 07 060646 +0000 2013|Debating a Fix For Hospitals In Dire Straits http//nytims/17Ho0YF
376059081100128256,Fri Sep 06 190726 +0000 2013|Well Think Like a Doctor The Gymnast’s Big Belly Solved http//nytims/17EBmcu
376026754428985344,Fri Sep 06 165859 +0000 2013|Observatory Hyperactivity Linked to Inner Ear Defect http//nytims/17Eky5l
376017395456180224,Fri Sep 06 162147 +0000 2013|Arsenic Levels in Rice Products Not a Health Risk FDA Says http//nytims/17Efyh5
376004040586723328,Fri Sep 06 152843 +0000 2013|Well A Cool Classic Sliced and Diced http//nytims/17E8OQi
375926328497025024,Fri Sep 06 101955 +0000 2013|Well Drinking When Young Increases Breast Cancer Risk http//nytims/18HuuYL
375832816678084608,Fri Sep 06 040820 +0000 2013|Fertility Rate Stabilizes as the Economy Grows http//nytims/18y5W5E
375814771683381248,Fri Sep 06 025638 +0000 2013|Your Money Adviser When Health Deductibles Rise Men Delay Emergency Care http//nytims/18xUJ5a
375692883808223232,Thu Sep 05 185218 +0000 2013|Changes to Poultry Rules Are Flawed Report Says http//nytims/1ejby8B
375684812985892864,Thu Sep 05 182013 +0000 2013|Gut Bacteria From Thin Humans Can Slim Mice Down http//nytims/18wCn4C
375667473401778176,Thu Sep 05 171119 +0000 2013|ECigarette Use Doubles Among Students Survey Shows http//nytims/18wonrz
375646075149099008,Thu Sep 05 154618 +0000 2013|Well When Med Students Get Medical Students’ Disease http//nytims/18w7iOo
375564095367704576,Thu Sep 05 102032 +0000 2013|The New Old Age Blog Online Lessons in Dementia Management http//nytims/1cJxrMx
375564093970989056,Thu Sep 05 102032 +0000 2013|Well Think Like a Doctor The Gymnast’s Big Belly http//nytims/1alhEGr
375449814085152768,Thu Sep 05 024625 +0000 2013|William Glasser 88 Psychiatrist Who Promoted Mental Health as a Choice Dies http//nytims/1dRCyyp
375449812445167616,Thu Sep 05 024625 +0000 2013|Clinton Urges Americans to Sign Up for Health Care Exchanges http//nytims/15F7oQJ
375441796253622272,Thu Sep 05 021434 +0000 2013|Your Money Adviser Deciding When to Enter a Palliative Care Unit http//nytims/1dRxudi
375348136539328512,Wed Sep 04 200224 +0000 2013|A Multitasking Video Game Makes Old Brains Act Younger http//nytims/18DSL23
375347774327238657,Wed Sep 04 200057 +0000 2013|Parents heres what to do if your child tears an ACL http//nytims/1ajip2T
375341983142662145,Wed Sep 04 193756 +0000 2013|Can you guess whats wrong with a gymnast who has a big belly Check nytimeswell tomorrow at 6AM ET for our next Think Like a Doctor
375325624828567553,Wed Sep 04 183256 +0000 2013|Whats the best fruit http//nytims/1ajw5Lf
375304987699843072,Wed Sep 04 171056 +0000 2013|Well Some Fruits Are Better Than Others http//nytims/15YRJA0
375120183083679745,Wed Sep 04 045635 +0000 2013|Well What to Do if Your Child Tears an ACL http//nytims/1ahYRvD
375079151272992768,Wed Sep 04 021332 +0000 2013|OpEd Contributors How a Cabal Keeps Generics Scarce http//nytims/15C0E61
375079149259739136,Wed Sep 04 021332 +0000 2013|National Briefing , Midwest Michigan State Ready to Expand Medicaid http//nytims/1ahJHXm
374963239915761664,Tue Sep 03 183257 +0000 2013|RT KarenBBarrow Have a breast cancer story nytimeswell wants to hear from you http//nytims/14e02nT
374917179801473024,Tue Sep 03 152955 +0000 2013|RT paulaspan Will your family make the medical decisions youd want at end of your life  Maybe not http//newoldageblogsnytimescom/2013/09/03/valuesconflictattheendoflife/r=0
374838402010857472,Tue Sep 03 101653 +0000 2013|The New Old Age Blog Values Conflict at the End of Life http//nytims/19eq4uE
374744817173282816,Tue Sep 03 040501 +0000 2013|Advertising With Change Coming Aetna Targets Employers http//nytims/17vU8Td
374645435400716288,Mon Sep 02 213007 +0000 2013|Nyad Completes CubatoFlorida Swim http//nytims/18mnh1r
374601326912880641,Mon Sep 02 183450 +0000 2013|Nyad 1st to Swim to Florida From Cuba Without Cage http//nytims/17FcYJs
374595999664459776,Mon Sep 02 181340 +0000 2013|Global Health Life Expectancy Grows for Women Age 50 and Up http//nytims/17F8bYq
374390579817623552,Mon Sep 02 043724 +0000 2013|Weekend Revelry Cut Short After 2 Die at Electronic Music Festival http//nytims/1727Tbj
374185082606469123,Sun Sep 01 150050 +0000 2013|Have breast cancer Tell us your story http//nytims/14e02nT
373747400265203712,Sat Aug 31 100138 +0000 2013|Chinese Chicken Processors Are Cleared to Ship to US http//nytims/14fzcLY
373747398407102464,Sat Aug 31 100138 +0000 2013|Lives A Brief Vacation From Myself http//nytims/12VU0dY
373562709880483840,Fri Aug 30 214745 +0000 2013|Perhaps all diseases bring egotism in their wake People in distress find it hard to think of anything else http//nytims/1dU7OKt
373519718994694144,Fri Aug 30 185655 +0000 2013|The New Old Age Blog In California Renewed Debate Over Home Care http//nytims/1coxTQ9
373510426346401792,Fri Aug 30 181959 +0000 2013|Well Dress Up Your Salad With Grains http//nytims/146mzIk
373503774905475072,Fri Aug 30 175333 +0000 2013|RT bstrauch Have a breast cancer story nytimeswell wants to hear from you http//wellblogsnytimescom/2013/08/29/shareyourbreastcancerstories/r=0
373487670808150016,Fri Aug 30 164934 +0000 2013|RT cslnyt 66 ppl died of serious tooth infections thousands were hospitalized http//nytims/15bS0fq AAEnews ADANews Smile4Health
373482177251381248,Fri Aug 30 162744 +0000 2013|Share your breast cancer stories with nytimeswell  http//nytims/14e02nT
373462337698951169,Fri Aug 30 150854 +0000 2013|Well Oral Infections Causing More Hospitalizations http//nytims/14e6gUG
373457977417932801,Fri Aug 30 145134 +0000 2013|Well Share Your Breast Cancer Stories http//nytims/145LtYO
373452553234567168,Fri Aug 30 143001 +0000 2013|RT cslnyt Beginning of the end of marijuana prohibition  http//nytims/1aRw7t3
373451977817985024,Fri Aug 30 142744 +0000 2013|Have a breast cancer story nytimeswell wants to hear from you http//nytims/14e02nT
373294781704974336,Fri Aug 30 040306 +0000 2013|Anthony Pawson Biologist in CellProtein Breakthrough Dies at 60 http//nytims/1cm5yKm
373294780085993472,Fri Aug 30 040305 +0000 2013|The Texas Tribune With Youth Tanning Law Texas Aims to Lower Melanoma Risk http//nytims/12RxD9D
373290985180381184,Fri Aug 30 034800 +0000 2013|Advertising ECigarette Makers’ Ads Echo Tobacco’s Heyday http//nytims/1cm5yKi
373290982915448832,Fri Aug 30 034800 +0000 2013|Taylor Farms Big Food Supplier Grapples With Frequent Recalls http//nytims/12RxD9B
373287038982033408,Fri Aug 30 033220 +0000 2013|US Won’t Sue to Reverse States’ Legalization of Marijuana http//nytims/1cm5AlD
373287037572767744,Fri Aug 30 033219 +0000 2013|NFL Agrees to Settle Concussion Suit for 765 Million http//nytims/12RxB1i
373195531146641408,Thu Aug 29 212842 +0000 2013|You asked We answered Is it better to bike or run http//nytims/1dU4i2U
373165384784162816,Thu Aug 29 192855 +0000 2013|Ask Well Is It Better to Bike or Run http//nytims/17parPH
373135852224151553,Thu Aug 29 173134 +0000 2013|Well Living With Cancer Is It Back http//nytims/17oR09F
373096860879036416,Thu Aug 29 145638 +0000 2013|RT bstrauch Think youre born a germfree blank slate Think again carlzimmer explains and its not bad news at allhttp//tco/9nkXkYA…
372931015981158400,Thu Aug 29 035737 +0000 2013|World Briefing , Asia China Police Search for Woman Accused of Gouging Out Boy’s Eyes http//nytims/185VMsQ
372931014026620928,Thu Aug 29 035737 +0000 2013|In Congress a Bid to Undo Dialysis Cuts http//nytims/1dsnXct
372866003614855168,Wed Aug 28 233917 +0000 2013|The New Old Age A Renewed Push for EndofLife Discussions http//nytims/16RKtFE
