511769625135415296,Tue Sep 16 065241 +0000 2014|The New Health Care New Estimates on Health Coverage Are Accurate but Outdated http//nytims/1r2f9Q0
511750773295026176,Tue Sep 16 053746 +0000 2014|US to End Coverage Under Health Care Law for Tens of Thousands http//nytims/YNxG84
511746818783584256,Tue Sep 16 052204 +0000 2014|Number of Americans Without Health Insurance Falls Survey Shows http//nytims/1phzawn
511746816430579713,Tue Sep 16 052203 +0000 2014|Obama to Call for Expansion of Ebola Fight http//nytims/1phz7kn
511742401254526976,Tue Sep 16 050430 +0000 2014|Arizona Republican Official Resigns After Remarks About Medicaid Recipients http//nytims/YNxG8a
511742400373719040,Tue Sep 16 050430 +0000 2014|New York Files an Antitrust Suit Against the Maker of an Alzheimer’s Drug  http//nytims/1phzawp
511723999056125952,Tue Sep 16 035123 +0000 2014|Do you prescribe preventative medicine when there is little evidence it is needed http//nytims/1tYoZ3V
511649311248384000,Mon Sep 15 225436 +0000 2014|Global Health Among Malaria Parasites Real Feel for Mosquitoes http//nytims/1BH9gef
511649309901983744,Mon Sep 15 225436 +0000 2014|Taking a Health Hazard Home  http//nytims/Znl87h
511648260701036544,Mon Sep 15 225025 +0000 2014|How should a doctor deal with a patient who admits she has HIV phobia http//nytims/1tYoZ3V
511645231021047809,Mon Sep 15 223823 +0000 2014|Stem Cells Plenty of Hope but Halting Progress http//nytims/1BH9hPv
511645229548834816,Mon Sep 15 223823 +0000 2014|Well But What if They Were to Die http//nytims/Znl87j
511622298953326592,Mon Sep 15 210716 +0000 2014|Well Ask Well Plantar Fasciitis Relief http//nytims/1qG4wmR
511613405128835073,Mon Sep 15 203155 +0000 2014|Reactions Cancer Screening at a Cost Your Uncomfortable Flight Fortunate Dinosaur Bones http//nytims/1BGVsjR
511586036246675456,Mon Sep 15 184310 +0000 2014|Going Inside the Rice Microbiome http//nytims/1wmhcPd
511549288116387840,Mon Sep 15 161709 +0000 2014|Well Off the Drugs Onto the Cupcakes http//nytims/ZmVXSs
511536447560904705,Mon Sep 15 152607 +0000 2014|The New Health Care Limiting Choice to Control Health Spending A Caution http//nytims/1uDGTua
511536445606330368,Mon Sep 15 152607 +0000 2014|Maker of Hepatitis C Drug Strikes Deal on Generics for Poor Countries http//nytims/ZmQL0Z
511528894466625536,Mon Sep 15 145606 +0000 2014|Well Beating Back the Risk of Diabetes http//nytims/ZmNCOB
511369569139978240,Mon Sep 15 042300 +0000 2014|Well Select Drugs Cause Most Childhood Poisonings http//nytims/Zm9QA8
511216746611875840,Sun Sep 14 181545 +0000 2014|Renewing Health Coverage May Not Be as Automatic as Government Says http//nytims/1qANaHQ
510984960141185024,Sun Sep 14 025442 +0000 2014|Rashi Fein Economist Who Urged Medicare Dies at 88 http//nytims/1q2qs5q
510984958719328256,Sun Sep 14 025442 +0000 2014|Back to the Slums of His Youth to Defuse the Ebola Time Bomb http//nytims/1m4JUU2
510859036666134528,Sat Sep 13 183420 +0000 2014|Opinion Should We All Take a Bit of Lithium http//nytims/WYLfzC
510616739860971520,Sat Sep 13 023132 +0000 2014|Both Sides Cite Urgency in Court Appeal of a Texas Law on Abortion Clinics http//nytims/1tKgA3N
510616738875334656,Sat Sep 13 023132 +0000 2014|NFL Agrees Brain Trauma in 1 in 3 Players http//nytims/1tKhyx4
510612118312595457,Sat Sep 13 021310 +0000 2014|Liberian President Pleads With Obama for Assistance in Combating Ebola http//nytims/1m1FoWa
510612117213691904,Sat Sep 13 021310 +0000 2014|US Scientists See Long Fight Against Ebola http//nytims/1tKgzNx
510534196000219137,Fri Sep 12 210332 +0000 2014|Contributing OpEd Writer Learning How to Exert SelfControl  http//nytims/X8XXfD
510529176492060672,Fri Sep 12 204335 +0000 2014|The New Old Age Blog Tougher Than They Look http//nytims/X8T1HB
510490035393929216,Fri Sep 12 180803 +0000 2014|What were afraid to say about Ebola  http//nytims/1xUs4rZ via nytopinion
510445881091698689,Fri Sep 12 151236 +0000 2014|Test your knowledge of the latest health news http//nytims/1xTHLjl
510423580992339969,Fri Sep 12 134359 +0000 2014|Well Bright Green Pesto That Won’t Fade http//nytims/1wikAdJ
510264185503371264,Fri Sep 12 031036 +0000 2014|Aid Worker Recovering From Ebola http//nytims/1BwxNmg
510260255910285312,Fri Sep 12 025459 +0000 2014|72Hour Wait for Abortion Is Enacted in Missouri http//nytims/1rYNOjZ
510260254576099328,Fri Sep 12 025459 +0000 2014|Pesticide Levels in Waterways Have Dropped Reducing the Risks to Humans http//nytims/1BwxPuh
510168224600977408,Thu Sep 11 204917 +0000 2014|RT paulaspan Surprising portion of seniors in ERs malnourished new UNC study finds judithgraham explains http//newoldageblogsnytimescom/2014/09/11/intheemergencyroomahiddenailment/
510153173475266561,Thu Sep 11 194929 +0000 2014|Matter Mining for Antibiotics Right Under Our Noses http//nytims/WOZBm4
510149440519548930,Thu Sep 11 193439 +0000 2014|Have you observed yourself or others granting a moral license to do bad after doing good http//nytims/ZiiyzE
510148705497133056,Thu Sep 11 193144 +0000 2014|A Window Into Everyday Morality via Text Message http//nytims/1tNIXBS
510148704368857088,Thu Sep 11 193143 +0000 2014|Dying of Ebola at the Hospital Door http//nytims/WOZDKO
510145613137453056,Thu Sep 11 191926 +0000 2014|But those who granted a kindness were more likely to commit a small act of rudeness that day – granting themselves “moral license” to do so
510145336397291522,Thu Sep 11 191820 +0000 2014|People on the receiving end of an act of kindness were about 10 percent more likely to do something nice themselves later in the day
510144612082929665,Thu Sep 11 191528 +0000 2014|More evidence that good deeds can be contagious  http//nytims/ZiiyzE http//nytims/ZiiyzE
510142508681416704,Thu Sep 11 190706 +0000 2014|RT bcsolomon My video dispatch from Liberia for nytimes Sick from Ebola amp dying at the hospital door http//nytims/1qnLFN9 http//t…
510139656739250176,Thu Sep 11 185546 +0000 2014|The New Old Age Blog In the Emergency Room a Hidden Ailment http//nytims/1tNF8gi
510130006581075968,Thu Sep 11 181726 +0000 2014|RT lpolgreen Ebola patients turned away at hospital gates in Liberia Harrowing dispatch from bcsolomon http//wwwnytimescom/video/ebolaplaylist/ http//t…
510126466177462273,Thu Sep 11 180321 +0000 2014|Meet McBaine a highly trained cancer detection dog http//nytims/ZiewHx http//pbstwimgcom/media/BxRVUWqIAAAxUy1png
510093123486486528,Thu Sep 11 155052 +0000 2014|Workplace wellness programs sound great But are they effective http//nytims/1tC4rho http//pbstwimgcom/media/BxQ2jLIEAAhBvwpng
510092637215682560,Thu Sep 11 154856 +0000 2014|The New Health Care Do Workplace Wellness Programs Work Usually Not http//nytims/1BuRuuJ
510091741937295362,Thu Sep 11 154522 +0000 2014|The perfect little highprotein packages pestofilled deviled eggs by MarthaRShulman http//nytims/1tC2XUq http//pbstwimgcom/media/BxQ1vI3IYAEfkpng
510085026957250560,Thu Sep 11 151842 +0000 2014|RT Sulliview Making science journalism understandable without losing the nuance  My post on pregnancy and antidepressants http//tco/d…
509922334065430528,Thu Sep 11 043213 +0000 2014|Study The most reliable workers are those who get seven to eight hours of sleep each night http//nytims/ZhfovO
509907698725683200,Thu Sep 11 033403 +0000 2014|Well Training Dogs to Sniff Out Cancer http//nytims/WLviwK
509899910225735680,Thu Sep 11 030306 +0000 2014|A new drug to treat obesity has gained approval by the FDA http//nytims/1uwQ7bF
509896396062097409,Thu Sep 11 024908 +0000 2014|Stabbing With Syringe in Nigeria Raises Concerns of Ebola as Weapon http//nytims/1qG52Qx
509876673094111232,Thu Sep 11 013046 +0000 2014|The gatesfoundation pledged 50 million to fight Ebola the largest sum it has ever committed to one outbreak http//nytims/ZhfjZd
509820105715625984,Wed Sep 10 214559 +0000 2014|Health insurance premiums are starting to look like wage growth and inflation http//nytims/ZhfCDd http//pbstwimgcom/media/BxMrzqIQAA42Cbpng
509789301518110720,Wed Sep 10 194335 +0000 2014|Gates Foundation Pledges 50 Million to Fight Ebola http//nytims/1pQ5RBd
509787379671244800,Wed Sep 10 193557 +0000 2014|RT michaelluo Horrific caseFamily of Mentally Ill Rikers Inmate Sues New York City Over His Death http//nytims/1qGc4Fc
509775468208603136,Wed Sep 10 184837 +0000 2014|RT bstrauch what happened at the clinic where Joan Rivers diedhttp//nytims/1tKZCpZ
509739291648724992,Wed Sep 10 162452 +0000 2014|Well HPV Vaccine Program in Australia Shows Success http//nytims/1lTJsrD
509735657749880832,Wed Sep 10 161025 +0000 2014|Risotto with Asparagus and Pesto http//nytims/1tx53Vu MarthaRShulman
509735022816137217,Wed Sep 10 160754 +0000 2014|The New Health Care Can We Have a FactBased Conversation About EndofLife Planning http//nytims/1lTGiUM
509727353657122816,Wed Sep 10 153726 +0000 2014|RT cslnyt Night before Joan Rivers died she told a friend she was “going in for a little procedure” http//nytims/1lVCwu9 anemonanyc j…
509727329774731264,Wed Sep 10 153720 +0000 2014|The New Health Care Latest Good News in Health Spending Employer Premiums http//nytims/1lVQKLJ
509726357560229888,Wed Sep 10 153328 +0000 2014|RT ReedAbelson Latest Good News in Health Spending Employer Premiums http//nytims/1ulmnPS via UpshotNYT
509720087574892544,Wed Sep 10 150833 +0000 2014|Enjoy sugary drinks Get ready to walk http//nytims/ZgUugv
509643601228595200,Wed Sep 10 100437 +0000 2014|Well Airplane Crew May Face Increased Melanoma Risk http//nytims/1xHHZtI
509554404467675136,Wed Sep 10 041011 +0000 2014|Phys Ed Drink Soda Take 12000 Steps http//nytims/1rVHqdf
509532735510413312,Wed Sep 10 024405 +0000 2014|At Surgery Clinic Rush to Save Joan Rivers’s Life http//nytims/1pNthXY
509532734591885312,Wed Sep 10 024405 +0000 2014|Seeing Abuse and a Pattern Too Familiar http//nytims/1rVDr03
509529427949408256,Wed Sep 10 023056 +0000 2014|Want your colleagues to be more reliable Encourage them to get 78 hours of sleep a night http//nytims/1ttrjzz
509463432425271296,Tue Sep 09 220842 +0000 2014|Maybe narrow health networks arent so bad http//nytims/1ttqXcl
509462156719312896,Tue Sep 09 220338 +0000 2014|RT bcsolomon A health worker checks himself in a mirror before entering highly contagious Ebola ward At MSF clinic in Liberia http//…
509462050578255872,Tue Sep 09 220312 +0000 2014|Paralyzed in a car crash then fired for using medical marijuana  http//nytims/1okJ6pA
509461550349185024,Tue Sep 09 220113 +0000 2014|“Virtually every single player in the NFL has a certifiable need for medical marijuana” http//nytims/1ttpbYv
509443470776205312,Tue Sep 09 204923 +0000 2014|Drugs Legal and Illicit May Be Hurting Pilot Performance Study Says http//nytims/1qD6d3e
509350060170444800,Tue Sep 09 143812 +0000 2014|RT cslnyt To be a good citizen you must get rid of unused Rx drugs as soon as youre finished w/ them Why Read this http//tco/r2GiR…
509349998212161536,Tue Sep 09 143757 +0000 2014|RT bencareynyt How to apply cognitive science to homework hour in the Motherlode blog http//nytims/1bHmkk6
509349869774192640,Tue Sep 09 143726 +0000 2014|RT bencareynyt My book HOW WE LEARN launches (blasts off) today Got buy and read it willya  http//amznto/1ui5pC0
509348893373784065,Tue Sep 09 143334 +0000 2014|RT paulaspan Most elderly nursing home patients with advanced dementia still getting meds of questionable benefit  Why http//tco/q…
509348739413454848,Tue Sep 09 143257 +0000 2014|Airplane seat designers had some notsogreat assumptions http//nytims/1to2ghd
509348603463499776,Tue Sep 09 143224 +0000 2014|Until now drugs could not legally be returned to pharmacies http//nytims/Zf5Q4v
509348518822420480,Tue Sep 09 143204 +0000 2014|RT ginakolata The Problem With Reclining Airplane Seat Design http//nytims/1qHXqM1 via nytimeswell Best yet on the seat problemReal d…
509265991579492352,Tue Sep 09 090408 +0000 2014|The New Old Age Blog Near Death and Overmedicated http//nytims/1p1MCVf
509208826193936384,Tue Sep 09 051659 +0000 2014|Coalition Urges Nations to Decriminalize Drugs and Drug Use http//nytims/1tplmUf
509185341837021184,Tue Sep 09 034340 +0000 2014|Ebola Cases Reported Up Sharply in Liberia http//nytims/1CLG3Ap
509185340310315008,Tue Sep 09 034339 +0000 2014|After First Plan Is Blocked Virginia Governor Reduces Medicaid Expansion Goals http//nytims/1CLG3Al
509181538492493824,Tue Sep 09 032833 +0000 2014|Reactions Antidepressants and Pregnancy Carb Conundrum http//nytims/1pJNhuj
509181537376800769,Tue Sep 09 032833 +0000 2014|Respiratory Virus Sickens Children in the Midwest http//nytims/1CLG2wh
509111541858566144,Mon Sep 08 225025 +0000 2014|Passengers aren’t the real problem in the whole reclining debate  Seat design is http//nytims/1to27ug
509110577575505921,Mon Sep 08 224635 +0000 2014|Well The Problem with Reclining Airplane Seat Design http//nytims/Zf5Y3S
509109934068596736,Mon Sep 08 224401 +0000 2014|Consumers can now return unused prescription medications like opioid painkillers to pharmacies http//nytims/1to10e2
509098439192625152,Mon Sep 08 215821 +0000 2014|Books In Doctored Shortcomings of Health Care and Doctor http//nytims/1oZXu5K
509094490548994049,Mon Sep 08 214239 +0000 2014|QampA Exploring the Connection Between Alcohol and Dementia http//nytims/Zf1omc
509094489596895232,Mon Sep 08 214239 +0000 2014|Global Health MosquitoBorne Viruses Hit Japan and the US http//nytims/Zf1SZE
509090059958898688,Mon Sep 08 212503 +0000 2014|http//Healthcaregov Upgrades Are Priority for New Health and Human Services Chief http//nytims/1oZXu5M
509090058633486336,Mon Sep 08 212503 +0000 2014|The New Health Care Doctors Magical Thinking About Conflicts of Interest http//nytims/Zf1omg
509057002233135104,Mon Sep 08 191341 +0000 2014|Well A Family Cycle of Diabetes http//nytims/1rvTkUR
509049411541159936,Mon Sep 08 184332 +0000 2014|Well A Sleep Sweet Spot http//nytims/1lNR6nm
509027655199776768,Mon Sep 08 171704 +0000 2014|To Curb Abuse Patients Allowed to Return Unused Pills to Pharmacies http//nytims/1rvlL5k
509014426327199744,Mon Sep 08 162430 +0000 2014|Well Obesity Around the Nation http//nytims/1rv67a2
509013038432006144,Mon Sep 08 161900 +0000 2014|RT carlzimmer Whoops again NIH uncovers 100yearold vials of ricin and agents of plague botulism and other fun amp games  http//tco/…
509001081201119232,Mon Sep 08 153129 +0000 2014|Lasker Winner Calls for More Genetic Testing for Cancer http//nytims/1usF0R9
508845531096182784,Mon Sep 08 051323 +0000 2014|Well In Prediabetes a Chance to Avert Crisis http//nytims/1urSTiw
508815355545157632,Mon Sep 08 031328 +0000 2014|The latest Ebola news http//nytims/1nZRWaW
508812134558756864,Mon Sep 08 030040 +0000 2014|Kathryn Morgan Uses Social Media as She Gears for Her Return http//nytims/1AoEKDl
508812133656973312,Mon Sep 08 030040 +0000 2014|Legal Use of Marijuana Clashes With Job Rules http//nytims/1lLZdRm
508807810034196480,Mon Sep 08 024329 +0000 2014|Can Apple Build a Cool and Convenient iWatch http//nytims/1AoEKn3
508807809056923650,Mon Sep 08 024329 +0000 2014|Grandma’s Meat Loaf Hardly Her Home Now Has a 3Star Chef http//nytims/1lLZh3o
508751675482726400,Sun Sep 07 230026 +0000 2014|Desperate to contain Ebola Sierra Leone has decreed a stringent new measure confining residents to their homes http//nytims/1qFyDs3
508736573765337088,Sun Sep 07 220025 +0000 2014|Unclear on the difference between the Jawbone and Misfit A guide to activity trackers http//nytims/1qFylBk
508721471796281344,Sun Sep 07 210025 +0000 2014|Is horseback riding good exercise Yes especially if you muck out your mount’s stall  http//nytims/1qFyvIW
508691267904352257,Sun Sep 07 190023 +0000 2014|Another good reason to go kick the ball around with your son or daughter this afternoon http//nytims/1qxIlOr
508645961896558592,Sun Sep 07 160022 +0000 2014|Looking for an activity tracker Heres our newly updated guide http//nytims/1qFylBk
508634566563987456,Sun Sep 07 151505 +0000 2014|Many people are immune to Ebola Finding them is the tricky part http//nytims/1qxHAEY
508632822270025728,Sun Sep 07 150809 +0000 2014|Teenagers try to avoid “green tobacco sickness” in the fields of North Carolina http//nytims/1qFy9lJ
508423621308874753,Sun Sep 07 011652 +0000 2014|Sierra Leone to Impose 3Day Ebola Quarantine http//nytims/1wcTGUB
508096715145359360,Sat Sep 06 033751 +0000 2014|New York City Reports 3 New Cases of Meningitis http//nytims/1pzo8ma
508085184764583936,Sat Sep 06 025202 +0000 2014|World Briefing , Asia Rare Outbreak of Dengue Fever in Japan http//nytims/1qD2zFg
508081364064034817,Sat Sep 06 023651 +0000 2014|Two Vaccines to Protect Against Ebola Could Be Available Within Weeks  http//nytims/1qD2ykB
508081362893824001,Sat Sep 06 023651 +0000 2014|Business Briefing  Warnings Issued for Keryx Dialysis Drug http//nytims/1CAk67b
508012842306772992,Fri Sep 05 220434 +0000 2014|Antibodies could be harvested from the blood of those who are immune to treat new Ebola victims http//nytims/1lFSfgI
508012672928190464,Fri Sep 05 220354 +0000 2014|RT heathertal A lot of people are likely immune to Ebola Now if we could just figure out who precisely http//nytims/1lFSfgI
508011929898860545,Fri Sep 05 220057 +0000 2014|What does new research about a lowcarb vs highfat diet mean you should actually eat anahadoconnor explores this http//nytims/1t9ZBI4
508003609351831552,Fri Sep 05 212753 +0000 2014|Opinion Studying Ebola Then Dying From It http//nytims/1rgcpdG
507990914246402048,Fri Sep 05 203726 +0000 2014|Well Think Like a Doctor Weaker and Weaker Solved http//nytims/1CzoAuP
507984952022298624,Fri Sep 05 201345 +0000 2014|Many in West Africa Are Thought to Be Immune to Ebola but Finding Them Won’t Be Easy http//nytims/1rfOwD2
507984949866409984,Fri Sep 05 201344 +0000 2014|Well Couscous Salads Big Bowls and Casseroles http//nytims/1rfQnrw
507980426561200128,Fri Sep 05 195546 +0000 2014|The New Old Age Blog A Picture of Dementia http//nytims/1CzgIJM
507976264490442752,Fri Sep 05 193913 +0000 2014|Does new research emphasizing a lowcarb diet mean you should eat more meat anahadoconnor answers reader questions http//nytims/1t9ZBI4
507975938051960832,Fri Sep 05 193756 +0000 2014|What’s the difference between a wholefood carb and a refined carb http//nytims/1t9ZBI4
507940409268776960,Fri Sep 05 171645 +0000 2014|Well New Answers About Carbs and Fat http//nytims/1t9sXWU
507910546180804608,Fri Sep 05 151805 +0000 2014|RT nycscribe South Africa and Kenya against medical advice are isolating countries hit by Ebola making matters worse http//tco/n68F…
507900990000201728,Fri Sep 05 144007 +0000 2014|The Other Ebola Toll African Economies http//nytims/1AeNT1g
507766773354344448,Fri Sep 05 054647 +0000 2014|National Briefing , Plains Nebraska Ebola Patient to Be Treated in Omaha http//nytims/1rbHeAe
507746023851450368,Fri Sep 05 042420 +0000 2014|Well Ask Well Is Horseback Riding Good Exercise http//nytims/1rbkJeD
507746022509252608,Fri Sep 05 042419 +0000 2014|Advertising Blurring Line Between Snack and Meal Mac and Cheese to Graze On http//nytims/1rC44oy
507741696227307520,Fri Sep 05 040708 +0000 2014|New York State Gives Health Insurers Average Rate Rise of 57 http//nytims/1rbkJeB
507741693740072960,Fri Sep 05 040707 +0000 2014|Study of Jewish Women Shows Link to Cancer Without Family History http//nytims/1rC4486
507678337243045889,Thu Sep 04 235522 +0000 2014|OpEd Contributor Why Do Doctors Commit Suicide http//nytims/WjKwch
507655774651547648,Thu Sep 04 222543 +0000 2014|Apple Nears Introduction of Smartwatch and Bigger iPhones http//nytims/YfBAXc
507655773737193472,Thu Sep 04 222542 +0000 2014|Merck Wins Approval of Novel ImmuneSystem Drug for Cancer http//nytims/1puqnXL
507640273367990272,Thu Sep 04 212407 +0000 2014|How plants use caffeine as instruments of control http//nytims/1CvfG1r
507639022504529920,Thu Sep 04 211909 +0000 2014|I can remember the early days of having schizophrenia” http//nytims/1CveJ9o
507638100172873728,Thu Sep 04 211529 +0000 2014|Even small amounts of exercise enable children to improve their focus http//nytims/1CvefQC
507637184589856768,Thu Sep 04 211150 +0000 2014|During the trial it emerged that Williams was known as TicTac man because he left behind Anatabloc samples similar to mints at meetings
507636327786246145,Thu Sep 04 210826 +0000 2014|Cash from a dietary supplement exec contributed to the fall of former Gov Bob McDonnell of Virginia http//nytims/1CvcK4X
507610297298083840,Thu Sep 04 192500 +0000 2014|The New Health Care How People Feel About Their EmployerSponsored Health Plans http//nytims/1r96N4M
507598480685035520,Thu Sep 04 183803 +0000 2014|IV Line Misplaced in Bungled Oklahoma Execution Report Says http//nytims/1qrtjJY
507598478059401217,Thu Sep 04 183802 +0000 2014|First Arrest Made in 2012 Steroid Medication Deaths http//nytims/1r8Uw0b
507581771006091264,Thu Sep 04 173139 +0000 2014|Well Living With Schizophrenia The Importance of Routine http//nytims/1unN7yr
507564034603106305,Thu Sep 04 162110 +0000 2014|RT carlzimmer A look at WHO’s shortcomings in the face of Ebola http//wwwnytimescom/2014/09/04/world/africa/cutsatwhohurtresponsetoebolacrisishtmlr=0 Slashed quirky budget for one thing
507563890654576640,Thu Sep 04 162036 +0000 2014|RT cslnyt Policies fly in the face of what we know about the importance of a child’s 1st few years http//nytims/1qxwGOm FordhamLawNYC
507563587846815744,Thu Sep 04 161924 +0000 2014|RT nytDeniseGrady Whos fat whos not state by state Colorado wins again  http//wwwcdcgov/obesity/data/prevalencemapshtmlVAh2BfozCeQtwitter
507563061189050368,Thu Sep 04 161718 +0000 2014|A 19yearold man collapses at work after months of increasing weakness Can you figure out why http//nytims/1CujCj8
507516764864118784,Thu Sep 04 131320 +0000 2014|Well Think Like a Doctor Weaker and Weaker http//nytims/1pN4Vn2
507383792152354816,Thu Sep 04 042457 +0000 2014|Well Put the Physical in Education http//nytims/Z7LMRG
507368861872959488,Thu Sep 04 032537 +0000 2014|VA Rules May Enable Benefits Long Denied to VietnamEra Veterans http//nytims/1rszJIS
507364785735081984,Thu Sep 04 030925 +0000 2014|3rd Missionary With Ebola Is Identified http//nytims/1oFATeE
507364784623611904,Thu Sep 04 030925 +0000 2014|Cuts at WHO Hurt Response to Ebola Crisis http//nytims/1rszMo0
507328523384938496,Thu Sep 04 004520 +0000 2014|Efforts to improve what children eat should begin before they even learn to walk studies suggest http//nytims/1CmBZGv
507282060076392448,Wed Sep 03 214042 +0000 2014|Observatory Action Films May Spur the Need to Feed http//nytims/1tumVEn
507282059136880641,Wed Sep 03 214042 +0000 2014|Health Care Spending to Rise Federal Experts Predict http//nytims/1t1ch3N
507280909893394432,Wed Sep 03 213608 +0000 2014|RT DanBilefsky A British Ebola patient fully recovers after taking an experimental drug spurring some cautious optimism My story http…
507280810798743552,Wed Sep 03 213544 +0000 2014|Will China Defeat Obesity http//nytims/1w7v5Re
507270089662803968,Wed Sep 03 205308 +0000 2014|Experimental Vaccine Shows Promise Against Dengue Fever http//nytims/1nxgsBi
507268373164879872,Wed Sep 03 204619 +0000 2014|Dr Lisa Sanderss next Think Like a Doctor goes up tomorrow at 9 Can you figure out why a 19yearold man is getting weaker
507266244329095169,Wed Sep 03 203751 +0000 2014|British Parents Reunited With Ill Child After Arrest in Spain http//nytims/1qd41iY
507266242785583104,Wed Sep 03 203751 +0000 2014|Unusual Drama School in Rome Is Set to Expand http//nytims/1nxgsBg
507262367731056640,Wed Sep 03 202227 +0000 2014|CDC says that anyone who was in the outbreak region and develops a fever of 1015 degrees or higher should seek immediate medical care
507260605527781376,Wed Sep 03 201527 +0000 2014|College Campuses Urged to Come Up with an Ebola Plan http//nytims/1CqV22w
507255641443164161,Wed Sep 03 195543 +0000 2014|The New Old Age Blog A Better Flu Shot http//nytims/1qcVegR
507246924819615744,Wed Sep 03 192105 +0000 2014|Mold problems come even without floods or overflowing bathtubs http//nytims/1CqUAkS
507245980413358080,Wed Sep 03 191720 +0000 2014|Beginning in August medical marijuana dispensaries in Berkeley will donate cannabis to lowincome residents  http//nytims/1CqU3iH
507245121034014720,Wed Sep 03 191355 +0000 2014|Worth revisiting this cslnyt piece on lack of scientific evidence about what exactly medical marijuana does http//nytims/1prtO8i
507244866557186048,Wed Sep 03 191255 +0000 2014|Texas Abortion Clinic to Reopen After Court Ruling http//nytims/1r2D7WW
507244293502013441,Wed Sep 03 191038 +0000 2014|I cant afford to buy it but my need isnt any less than anyone elses”  http//nytims/1lzxOSu iglovett on medical marijuana
507240397442404352,Wed Sep 03 185509 +0000 2014|Perdue Eliminates Antibiotic Use in Its Hatcheries http//nytims/1qcHJOi
507239640144039936,Wed Sep 03 185208 +0000 2014|CVS will no longer sell cigarettes http//nytims/1CqPV2m
507229193584017408,Wed Sep 03 181038 +0000 2014|Up to 14 percent of pregnant women take antidepressants http//nytims/1CqJ6Oe
507228924007706624,Wed Sep 03 180934 +0000 2014|More than 3500 Ebola cases have been confirmed so far http//nytims/1w6QDNO
507228747368779776,Wed Sep 03 180851 +0000 2014|British nurse who contracted Ebola in West Africa and was treated with ZMapp has fully recovered http//nytims/1CqIPuI
507227534677651456,Wed Sep 03 180402 +0000 2014|CVS stores will no longer sell tobacco products (Photo Andrew Renneisen/NYT) http//nytims/1w6pmuR http//pbstwimgcom/media/BwnuyFfIQAA7RAGjpg
507219176961105920,Wed Sep 03 173050 +0000 2014|Physical activity does not increase people’s risk of developing ALS  http//nytims/1w6Ic4W
507216597275406337,Wed Sep 03 172035 +0000 2014|RT ReedAbelson Bracing for New Challenges in Year 2 of Health Care Law http//nytims/1q9hAzX See my story about expectations for upcomin…
507215404717309952,Wed Sep 03 171550 +0000 2014|British Ebola Patient Discharged From Hospital http//nytims/1u0V64Y
