470769919651745792,Mon May 26 033429 +0000 2014|Hospitals Look to Health Law Cutting Charity http//nytims/SCZ4Cc
469914320701517824,Fri May 23 185439 +0000 2014|Poison Pen Silver Too Small to See but Everywhere You Look http//nytims/1pjOdrB
469894310511398912,Fri May 23 173508 +0000 2014|You asked we answered Do you need to burn 2000 calories a week for optimal fitness askwell http//nytims/1ttnzyT
469879809548754944,Fri May 23 163731 +0000 2014|Well Blueberries for All http//nytims/1naXl2r
469872475635859458,Fri May 23 160822 +0000 2014|RT celiadugger Geriatrics Society warns about too much Ensure Ive asked my Moms caretakers to stop giving it like milk shakes http//…
469863582566334464,Fri May 23 153302 +0000 2014|Do you feel more stressed at work or at home At answer may surprise you http//nytims/1ttn2x3
469692414098411520,Fri May 23 041252 +0000 2014|Well Ask Well For Fitness 2000 Calories a Week http//nytims/1gVhVDL
469676020040466432,Fri May 23 030743 +0000 2014|OpEd Contributors You’re Never Too Old to Be Studied http//nytims/1gVaoVD
469600561105756160,Thu May 22 220753 +0000 2014|Well Women With Diabetes Face Greater Heart Risks Than Men http//nytims/1gnQulx
469577573765484545,Thu May 22 203632 +0000 2014|Well Is Work Your Happy Place http//nytims/1maGPOT
469573182928990208,Thu May 22 201905 +0000 2014|RT paulaspan Nutritional supplements like Boost and Ensure  DoctorpaulMD denounces liquid candy bars w/ vitaminsat  AGS14 http//…
469555476565610497,Thu May 22 190844 +0000 2014|RT nytDeniseGrady Who knew The placenta has a microbiome Study Sees Bigger Role for Placenta in Newborns’ Health http//nytims/1h8VTYO
469531596081872896,Thu May 22 173350 +0000 2014|The New Old Age Blog Geriatricians Beware ‘Liquid Candy’ http//nytims/1lGzinE
469484212018765826,Thu May 22 142533 +0000 2014|RT cslnyt Mice like to run Who knew  jimgorman http//nytims/1m1a2M7
469484018267074560,Thu May 22 142447 +0000 2014|How to lose 11 pounds in 4 days http//nytims/1nuF0f4
469421726670282752,Thu May 22 101715 +0000 2014|Well Where You Live Matters for Lifesaving Liver Transplants http//nytims/1j9MobB
469339221271269376,Thu May 22 044924 +0000 2014|US Campaign Urges Gay Men to Talk About HIV http//nytims/1gmflGq
469339220260442112,Thu May 22 044924 +0000 2014|With New Bill Abortion Limits Spread in South http//nytims/1sWWxxT
469333259714039808,Thu May 22 042543 +0000 2014|Well 4 Days 11 Pounds http//nytims/1gmdLo6
469318749594861568,Thu May 22 032804 +0000 2014|OpEd Contributors Depressed but Not Ashamed http//nytims/1gm9m4l
469194382353399808,Wed May 21 191352 +0000 2014|Well Drowning Risk Varies by Age and Race http//nytims/1nqLGdU
469188917439516672,Wed May 21 185209 +0000 2014|Study Sees Bigger Role for Placenta in Newborns’ Health http//nytims/R9ZkY7
469155664846422016,Wed May 21 164001 +0000 2014|The brains of college football players are subtly different from the brains of other students a new study shows http//nytims/1npUH7g
469133868864655360,Wed May 21 151325 +0000 2014|RT paulaspan The 88 Doctors who would choose DNR status if they were terminally ill http//newoldageblogsnytimescom/2014/05/20/donotresuscitatewhatyoungdoctorswouldchoose/
469133826644787201,Wed May 21 151315 +0000 2014|RT celiadugger Stuart Little take note even uncaged mice love the wheel http//nytims/1m1a2M7
468981312943321088,Wed May 21 050712 +0000 2014|Well Brain Changes in College Football Players Raise New Concerns http//nytims/1i2jGty
468889966215696384,Tue May 20 230414 +0000 2014|Study Shows That Mice Run for Fun Not Just for Lab Work http//nytims/1jpdG2a
468864245611134976,Tue May 20 212201 +0000 2014|RT KarenBBarrow Ecigarettes seem to help smokers who want to quit http//nytims/1nlzL0V
468863589412261888,Tue May 20 211925 +0000 2014|RT nytimes Smokers trying to quit are more likely to succeed if they used ecigarettes than patches or gum study says http//tco/vdUmAC…
468840955505016832,Tue May 20 194929 +0000 2014|Graphic How certain diseases may determine a health laws success http//nytims/1k33cGi
468832680709472256,Tue May 20 191636 +0000 2014|The New Old Age Blog Do Not Resuscitate What Young Doctors Would Choose http//nytims/1nl81JO
468798558628761600,Tue May 20 170100 +0000 2014|How long would it take you to memorize the order of 51 cards in a deck (For Simon Reinhard it takes 2119 seconds) http//nytims/1nk6qUM
468791533081489408,Tue May 20 163305 +0000 2014|RT celiadugger Forgetting critical skill of memory athletes  bencareynyt repts http//nytims/1lW7bE3
468791273894453248,Tue May 20 163204 +0000 2014|RT celiadugger English study finds ecigs more helpful than nicotine patch or gum in helping smokers quit http//nytims/1giP9MJ
468784299018579968,Tue May 20 160421 +0000 2014|Study Gives ECigarettes Edge in Helping Smokers Quit http//nytims/R4HDsW
468605488385769472,Tue May 20 041349 +0000 2014|US Cites End to CIA Ruses Using Vaccines http//nytims/Tojz6v
468551621325389824,Tue May 20 003946 +0000 2014|Rating the Health Law’s Success http//nytims/1oKJZMk
468514842127896576,Mon May 19 221337 +0000 2014|Letters Pets Driving With a Dog (1 Letter) http//nytims/1vuDPBG
468510187968794624,Mon May 19 215507 +0000 2014|Letters ADHD Treatment Without Drugs (1 Letter) http//nytims/1sMzANO
468510186978959361,Mon May 19 215507 +0000 2014|Letters Scoliosis Exercise Not Braces (1 Letter) http//nytims/1vuDPBC
468505559532965889,Mon May 19 213644 +0000 2014|Well Remembering as an Extreme Sport http//nytims/1sMw0TS
468504111105970176,Mon May 19 213059 +0000 2014|Will the World Cup cause an outbreak of Dengue fever http//nytims/1jwEVcs
468497965855014915,Mon May 19 210633 +0000 2014|Well When Doctors Treat Patients Like Themselves http//nytims/R1iwY3
468476444260458497,Mon May 19 194102 +0000 2014|Global Health With World Cup in Brazil Risk of Spreading a Virus http//nytims/1vua6J4
468467347771363328,Mon May 19 190454 +0000 2014|RT cslnyt “A major breakthrough” for patients w/ idiopathic pulmonary fibrosis a fatal lung disease http//nytims/1gXjLhW nytdenisegra…
468457426778591232,Mon May 19 182528 +0000 2014|Well Using a Patient’s Own Blood in Heart Surgery http//nytims/1gHE1ti
468450757176737793,Mon May 19 175858 +0000 2014|Bacteria mosquitoes spiders the sun ahh the dangers of summer http//nytims/1jw0ry3
468430125806411777,Mon May 19 163659 +0000 2014|Recipes for Health Blueberry or Blackberry Compote With Yogurt or Ricotta http//nytims/1ggzE8d
468416482557583360,Mon May 19 154246 +0000 2014|Well Ask Well AIDS and Truvada http//nytims/1lFrjIU
468397898041135104,Mon May 19 142855 +0000 2014|RT cslnyt Thousands of Toddlers Are Prescribed ADHD Drugs Why http//nytims/1jnBG77
468253483024809984,Mon May 19 045504 +0000 2014|Well This Summer Safety First http//nytims/1kgtKDv
468241405476085760,Mon May 19 040705 +0000 2014|Sidney J Blatt Dies at 85 Developed ‘Double Helix’ Theory of Depression http//nytims/QYePlY
468142646410899456,Sun May 18 213439 +0000 2014|Drugs Found to Aid Breathing in a Fatal Lung Disease http//nytims/1lBPqIz
467519664638414849,Sat May 17 041908 +0000 2014|Business Briefing Pfizer to Apply for Breast Cancer Drug Approval http//nytims/1hSCJGF
467515201882173440,Sat May 17 040124 +0000 2014|Clyde Snow a Sleuth Who Read Bones is Dead at 86 http//nytims/1vhI4Az
467515200384815104,Sat May 17 040124 +0000 2014|Mother Accuses Doctors of Forcing a CSection and Files Suit http//nytims/1vhI4Ap
467498667507982336,Sat May 17 025542 +0000 2014|Thousands of Toddlers Are Medicated for ADHD Report Finds Raising Worries  http//nytims/1sCGYvd
467431106858721280,Fri May 16 222714 +0000 2014|You asked we answered What are the side effects of taking Truvada daily to prevent HIV askwell http//nytims/1jRC90G
467427986418204672,Fri May 16 221451 +0000 2014|RT paulaspan Another good reason to get the shingles vaccine UK study shows higher stroke risk http//newoldageblogsnytimescom/2014/05/16/whenshinglesisjustthebeginning/
467388430637613057,Fri May 16 193740 +0000 2014|The New Old Age Blog When Shingles Is Just the Beginning http//nytims/1lwK93t
467361643307884544,Fri May 16 175113 +0000 2014|For people with Type 2 diabetes two large meals may be better than the same amount of food eaten in 6 small meals http//nytims/1jQuGiu
467359578175578112,Fri May 16 174301 +0000 2014|Well Summer Burgers Hold the Meat http//nytims/1jD2cDI
467156776660783104,Fri May 16 041709 +0000 2014|Well Tracking Down the Deer Runner http//nytims/1k6UXsm
467151393082867712,Fri May 16 035546 +0000 2014|AIDS Groups Back AntiHIV Pill Amid Concerns Doctors and Patients Will Resist http//nytims/1k6RaLo
467151392013312000,Fri May 16 035545 +0000 2014|FDA Recommends Lower Dose of the Sleeping Pill Lunesta http//nytims/1lG7PFz
467065269920477184,Thu May 15 221332 +0000 2014|Well A Meal Schedule for Diabetes http//nytims/1jzT9n4
467007907620749312,Thu May 15 182536 +0000 2014|Well Wine Ingredient May Have Few Health Benefits http//nytims/1qGaynG
466991193159520258,Thu May 15 171911 +0000 2014|Does a medical student need to disclose every error  however minor  they may make http//bitly/1swoI6y
466975582392418304,Thu May 15 161709 +0000 2014|From the archive Truvada’s use has been slow to catch on  http//nytims/1swok8d
466975091855986688,Thu May 15 161512 +0000 2014|RT celiadugger Feds recommend daily pill to prevent persistent spread of HIV in US shifting from primary focus on condoms  http//tco/…
466975069030604801,Thu May 15 161507 +0000 2014|RT cslnyt Routine gender bias in basic research must end says NIH http//nytims/1jgDxdV ronicaryn
466953343789965312,Thu May 15 144847 +0000 2014|Well When Medical Students Make Errors http//nytims/1qFKGIL
466775195261603840,Thu May 15 030053 +0000 2014|Get to 100 and Life Actually Doesn’t Feel so Bad http//nytims/1lBfYLu
466775193768443904,Thu May 15 030053 +0000 2014|Proper Death Planning Is a Final Gift to Loved Ones http//nytims/1ost29i
466771339467296768,Thu May 15 024534 +0000 2014|The Age Premium http//nytims/1lBeO2H
466771338431307779,Thu May 15 024533 +0000 2014|A Study on Prostate Cancer Relapses Suggests That Hormone Therapy Can Wait http//nytims/1ossz6X
466767170756939777,Thu May 15 022900 +0000 2014|World Briefing Saudi Arabia 5 More Deaths From Virus Reported http//nytims/1osr7la
466761633818505216,Thu May 15 020700 +0000 2014|Do you have a question about Truvada askwell   Advocating pill US signals shift to prevent AIDS  http//nytims/1jJGiUi
466731447265808384,Thu May 15 000703 +0000 2014|Advocating Pill US Signals Shift to Prevent AIDS http//nytims/1g6IJQV
466700774756474880,Wed May 14 220510 +0000 2014|The CDC has announced new recommendations that all those at high risk for HIV take a daily preventative drug http//nytims/1jIYihw
466700773628194817,Wed May 14 220509 +0000 2014|Do you have a question about this HIVpreventing drug Tweet askwell http//nytims/1j9EVxZ
466698204353167360,Wed May 14 215457 +0000 2014|US Recommends Daily Pill to Fight AIDS Infections http//nytims/1hMmnzs
466666707252445184,Wed May 14 194947 +0000 2014|NIH Tells Researchers to End Sex Bias in Early Studies http//nytims/1hMaZ6u
466635706635681792,Wed May 14 174636 +0000 2014|Essay Looking for the Final Word on Treatment http//nytims/1v5iGOp
466601869414895617,Wed May 14 153209 +0000 2014|Instead of a large allout workout have you tried exercising in snacksize portions  http//nytims/1jtdqKX
466587469199470593,Wed May 14 143456 +0000 2014|RT celiadugger Two drugs that could help alcoholics quit are little prescribed  anahadoconnor repts http//nytims/1sqM915
466581980189327360,Wed May 14 141307 +0000 2014|Well Exercise ‘Snacks’ to Control Blood Sugar http//nytims/1k14z7Z
466431036583575553,Wed May 14 041319 +0000 2014|Health Care Workers Under Attack in Syria Doctors Say http//nytims/1nM1I3c
466416818463473664,Wed May 14 031649 +0000 2014|Doubts Raised About OffLabel Use of Subsys a Strong Painkiller http//nytims/1oq4rlA
466416816756371459,Wed May 14 031649 +0000 2014|World Briefing Pakistan Departing Travelers Must Get Polio Vaccine http//nytims/1nLRXSM
466328701328949248,Tue May 13 212641 +0000 2014|RT cslnyt Fewer than 10 of alcoholics are prescribed medications that could help them quit  drinking Why anahadoconnor http//tco/61…
466308724228128768,Tue May 13 200718 +0000 2014|Effective Drugs to Curb Alcoholism Are Ignored Study Finds http//nytims/1laTHCp
466306920551178240,Tue May 13 200008 +0000 2014|Being the victim of a bully is more than just bad for your mental health its bad for your body too http//nytims/1jE4gAm
466291305170345985,Tue May 13 185805 +0000 2014|RT paulaspan Teens mentoring seniors to help bring them online  New documentary shows some problems  but might work http//tco/LjIl6…
466242746882076672,Tue May 13 154507 +0000 2014|Can meditation and mental exercises be better than drugs at helping people with attention problems http//nytims/1jD31kJ
465965160868241408,Mon May 12 212206 +0000 2014|Stretching exercises may be a cure for scoliosis http//nytims/1jktP46
465960756291592193,Mon May 12 210436 +0000 2014|Reactions Statins ad Women Birth Defects and Polio Abroad http//nytims/1iL7ykD
465955486182154241,Mon May 12 204339 +0000 2014|Global Health A Charity’s Video Shows Models Duped for a Cause http//nytims/1mP3V0P
465955484567371777,Mon May 12 204339 +0000 2014|The New Old Age They’ve Deleted Their ‘Spacebook’ Profiles http//nytims/QBB1Sx
465951622187986944,Mon May 12 202818 +0000 2014|Mind Exercising the Mind to Treat Attention Deficits http//nytims/1mOZu6d
465947220995756032,Mon May 12 201049 +0000 2014|Well Hope for an SShaped Back http//nytims/QBxljW
465947219301253120,Mon May 12 201048 +0000 2014|Observatory New Neurons Found to Overwrite Old Memories http//nytims/QBxlAc
465943402077782016,Mon May 12 195538 +0000 2014|Second Case of MERS Virus Is Announced http//nytims/QBsMGb
465939086365446144,Mon May 12 193829 +0000 2014|Well Moving Against Heart Disease http//nytims/1mOSWEB
465932604504829952,Mon May 12 191244 +0000 2014|Well Being Bullied Is Bad for Your Health http//nytims/1mOOfdV
465882363470176256,Mon May 12 155305 +0000 2014|Dog ownership isnt always the fun it seems like it should be http//nytims/1jjuMtJ
465880554991542272,Mon May 12 154554 +0000 2014|Suvir Saran’s Mushroom and Farro Burger http//nytims/RAyjOd
465867625781026816,Mon May 12 145432 +0000 2014|RT celiadugger WHO rec that all Pakistanis get polio vaccines before leaving country seems to have finally made its elite worry http//t…
465867592788606976,Mon May 12 145424 +0000 2014|RT celiadugger Donald McNeils story about vaccinators risking murder to protect millions of children from polio http//nytims/18tMSqu
465707846936444929,Mon May 12 041937 +0000 2014|Well The Drawbacks of Puppy Love http//nytims/1hGNJqC
464879231508303872,Fri May 09 212700 +0000 2014|You asked we answered Do I need a polio vaccine booster askwell http//nytims/1jaRrIx
464866770105667585,Fri May 09 203729 +0000 2014|Ask Well New Questions About Polio Shots http//nytims/1ghCDYx
464832673559490560,Fri May 09 182200 +0000 2014|A new documentary Fed Up tries to figure out if eating less is truly the key to losing weight http//nytims/1japRek
464824047780790273,Fri May 09 174743 +0000 2014|RT nytDeniseGrady Doctors Use Patient’s Immune Cells to Shrink Cancer Tumors http//nytims/1kPAlTk
464824022912761856,Fri May 09 174737 +0000 2014|RT celiadugger Fighting the invisibility of schizophrenia by inviting people who have it to tell their stories in oral histories http//…
464742070750818304,Fri May 09 122158 +0000 2014|Well ‘Fed Up’ Asks Are All Calories Equal http//nytims/1iy3n74
464595051134615552,Fri May 09 023746 +0000 2014|Deadly Illness in Nicaragua Baffles Experts http//nytims/1iuxf8G
464537404914012160,Thu May 08 224842 +0000 2014|Well Hurricane Stress Linked to Stillbirths http//nytims/1m3i8Ep
464509769198604288,Thu May 08 205853 +0000 2014|Well Living with Cancer Careless Care http//nytims/1srYC6r
464494689144418307,Thu May 08 195858 +0000 2014|What do you know about current health news Test your health knowhow by taking our weekly health quiz http//nytims/1j7rppu
464481854188306432,Thu May 08 190758 +0000 2014|Doctors use patient’s immune cells to shrink cancer tumors http//nytims/1jl0Su7
464471094129623041,Thu May 08 182512 +0000 2014|Doctors Use Patient’s Immune Cells to Shrink Cancer Tumors http//nytims/1j7nc5d
464437813136486400,Thu May 08 161258 +0000 2014|Voices that say Id be better off dead says Amber Hear more from the Schizophrenia Oral History Project http//nytims/1jk3rfY
464399969869627392,Thu May 08 134235 +0000 2014|Public Health Vaccine Opponents Can Be Immune to Education http//nytims/1sq4X2s
464345765444608000,Thu May 08 100712 +0000 2014|Well The Silence of Doctors Around Alzheimer’s http//nytims/1osZtl4
464256691820060672,Thu May 08 041315 +0000 2014|Well Stories as a Window Into Schizophrenia http//nytims/1qgyj5C
464149906882826241,Wed May 07 210855 +0000 2014|RT cslnyt Yet if you missed the boat it really is never too late to start exercising says Dr Jacobs of UMNews http//nytims/Qe66f5
464088251817398275,Wed May 07 170356 +0000 2014|Fit body at 25 fit brain at 50 GretchenReynold explains http//nytims/1j33qIa
464056080016748545,Wed May 07 145605 +0000 2014|RT cslnyt The more fit you are at 25 the better your thinking in middle age http//nytims/1jbHDmr GretchenReynold
463895278823555072,Wed May 07 041707 +0000 2014|Well Early Fitness Can Improve the MiddleAge Brain http//nytims/1kKiV9d
463788254458687488,Tue May 06 211151 +0000 2014|Mosquitodissecting robots Crowdfunding has begun to help build robots that can speed malaria vaccine production  http//nytims/1jaauYo
463760485557764096,Tue May 06 192130 +0000 2014|RT albertsun With a firmware update the Withings Pulse can now track blood oxygenation http//wellblogsnytimescom/projects/activitytrackers
463760218682564608,Tue May 06 192027 +0000 2014|RT paulaspan So great to talk with the brilliant Roz Chast about eldercare and her potent new book http//newoldageblogsnytimescom/2014/05/06/aconversationwithrozchast/
463758514582982656,Tue May 06 191340 +0000 2014|Do you have a question about the polio vaccine  Click here to submit yours http//nytims/1j9EVxZ
463748003283484672,Tue May 06 183154 +0000 2014|Looking for an activity tracker Well has just updated its tracker guide Now with a review of the Garmin Vivofit http//nytims/1fmPerS
463733230286671872,Tue May 06 173312 +0000 2014|Do you have a question about the polio vaccine askwell Donald G McNeil Jr will be answering your questions http//nytims/1j99UtW
463721514723201024,Tue May 06 164639 +0000 2014|The New Old Age Blog A Conversation With Roz Chast http//nytims/1kTkKng
463695675335909376,Tue May 06 150358 +0000 2014|Fiber after a heart attack decreases ones risk of death http//nytims/1j8lOnR
463684892044574720,Tue May 06 142107 +0000 2014|RT cslnyt Should so many women be taking statins http//nytims/1hsJ7nT ronicaryn
463684812008878080,Tue May 06 142048 +0000 2014|RT cslnyt Mortality drop after ’06 health law in Mass “It’s big http//nytims/1if5dhu stavernise
463605083906015232,Tue May 06 090400 +0000 2014|Health Policy Perspective Universal Mammogram Screening Shows We Don’t Understand Risk http//nytims/1sf5c0f
463446522143993856,Mon May 05 223355 +0000 2014|Massachusetts Death Rate Fell After Overhaul http//nytims/1kQqVIO
463439715882901504,Mon May 05 220653 +0000 2014|Should so many women be taking statins http//nytims/1j3XHXo
463429097511981056,Mon May 05 212441 +0000 2014|Reactions A Debt to the Future Face of Pain Science Meets Fiction http//nytims/1kQeZXr
463423289277571073,Mon May 05 210136 +0000 2014|Global Health A Goal to Combat Malaria With the Help of a Robot http//nytims/1kQb1Ox
463411117252169729,Mon May 05 201314 +0000 2014|Well A New Women’s Issue Statins http//nytims/RlUlUC
463411116081967105,Mon May 05 201314 +0000 2014|Books ‘The Sober Truth’ Seeing Bad Science in Rehab http//nytims/RlVZFV
463406634715598850,Mon May 05 195526 +0000 2014|Well After a Heart Attack Eat Your Fiber http//nytims/Su5AeR
463394657578524673,Mon May 05 190750 +0000 2014|QampA Red in the Face http//nytims/RhMOXe
463374250653790208,Mon May 05 174645 +0000 2014|RT celiadugger Adult onset type 2 diabetes up 30 in kids and type 1 up 21 cslnyt repts Lifelong struggle ahead http//tco/YWRTNC…
463374145053790208,Mon May 05 174619 +0000 2014|RT celiadugger On Staten Island people hooked on presciption pain pills turn to heroin for cheaper high driving epidemic http//tco/J…
463374093371580416,Mon May 05 174607 +0000 2014|RT cslnyt Polio  thought to be eradicated 2 yrs ago  is now spreading quickly WHO http//nytims/1hrDOVK
463374043069313024,Mon May 05 174555 +0000 2014|RT cslnyt Insufficient oxygen to brain in labor isnt necessarily the cause of injuries in newborns Truth = complex http//tco/zf3hsqJ…
463346349023326209,Mon May 05 155552 +0000 2014|Maternal health and genes not just a lack of oxygen during delivery can play a role in brain injuries in newborns http//nytims/1j2t2ts
463325655355367424,Mon May 05 143339 +0000 2014|RT paulaspan Two million more seniors w/heart failure can now get Medicarecovered lifesaving cardiac rehab But will they http//tco…
463284181297295360,Mon May 05 114850 +0000 2014|Polio Spreading at Alarming Rates World Health Organization Declares http//nytims/1ndYaZV
463169742451523584,Mon May 05 041406 +0000 2014|Well Hurt Before the Birth http//nytims/1s9c0fy
463001116729679872,Sun May 04 170403 +0000 2014|Young Blood May Hold Key to Reversing Aging http//nytims/1iYIpDm
462952637944844288,Sun May 04 135124 +0000 2014|RT amyharmon Ever hit a paywall trying to access a scientific paper For a story would love examples from nonscientists Plz email me …
462417454623637504,Sat May 03 022447 +0000 2014|How Being Hit by a Vehicle Changed Times Colleagues’ Lives http//nytims/1ktwslo
462342196860309504,Fri May 02 212544 +0000 2014|The New Old Age Blog A New Benefit for Heart Failure Patients http//nytims/1i7AcYi
462331134311804930,Fri May 02 204146 +0000 2014|Helmets on infants dont help to fix skull flattening a new study says http//nytims/1fVQ1Bq
462323912396001280,Fri May 02 201304 +0000 2014|Well Think Like a Doctor 18Year Rash Solved http//nytims/1i7lmAZ
462272015987396608,Fri May 02 164651 +0000 2014|Well Drink Your Greens http//nytims/1iLHOQk
462270230417248256,Fri May 02 163946 +0000 2014|The question doctors should   but dont  ask Can you afford this http//nytims/1fVPzDx
462254878807449602,Fri May 02 153846 +0000 2014|You asked we answered Are high triglycerides an independent risk factor for heart disease askwell http//nytims/1fVPpvG
462238024676696064,Fri May 02 143147 +0000 2014|RT cslnyt Helmets dont help round out infant skull flattening says a study by RenskevanWijk http//nytims/1rMfuTc
462044549746278400,Fri May 02 014259 +0000 2014|Well Helmets Do Little to Help Moderate Infant Skull Flattening Study Finds http//nytims/1n8PZvp
461948106167562241,Thu May 01 191945 +0000 2014|Well Do Statins Change Our Eating Habits http//nytims/1jm4pHJ
461941305409425409,Thu May 01 185244 +0000 2014|UV drying lamps at nail salons may increase your risk of skin cancer http//nytims/1fTunho
461889713113018368,Thu May 01 152743 +0000 2014|Can you Think Like a Doctor and figure out why this woman has had a rash on her hands for almost 18 years http//nytims/1fT1Ng3
461879474402107392,Thu May 01 144702 +0000 2014|Well Coffee Tied to Lower Diabetes Risk http//nytims/1n6QHJu
461873382695645184,Thu May 01 142250 +0000 2014|RT celiadugger Some risk of skin damage from nail polish drying lamps reports taraparkerpope  http//nytims/1kuwLiC
461719997950468096,Thu May 01 041320 +0000 2014|Well Think Like a Doctor The 18Year Rash http//nytims/R5ubFx
461697429793161216,Thu May 01 024339 +0000 2014|Business Briefing Endo to Pay 830 Million to Settle Claims Over Devices http//nytims/1u6WT8k
461599281032740864,Wed Apr 30 201339 +0000 2014|Well Study Sees Skin Cancer Risk in Nail Salon Lamps http//nytims/1jiVS8o
461579662892597248,Wed Apr 30 185542 +0000 2014|Can you Think Like a Doctor Why has this woman had a rash on her hands for 18 years Visit http//nytims/1iWDUH8 at 12AM ET to guess
461564563259789312,Wed Apr 30 175541 +0000 2014|Need a creative boost Take a walk Even a boring one can spur creativity http//nytims/1iIn6Wk
461527316007370752,Wed Apr 30 152741 +0000 2014|Why are dangerous supplements still on store shelves anahadoconnor  explains http//nytims/1iIe9fQ
461519321312014336,Wed Apr 30 145555 +0000 2014|RT celiadugger All who follow health news from the http//nytimescom The health link is back at the top of our home page navigation…
461479201624035328,Wed Apr 30 121630 +0000 2014|Well Why Dangerous Supplements Linger on Store Shelves http//nytims/1o2YSGz
461358270645817344,Wed Apr 30 041558 +0000 2014|Well Want to Be More Creative Take a Walk http//nytims/1pMCHcj
461337063921844224,Wed Apr 30 025141 +0000 2014|News Analysis Quietly Building Focus on College Sexual Assaults http//nytims/1iAtvhx
461247968608124928,Tue Apr 29 205739 +0000 2014|24 healthy new recipes that include your favorite green kale http//nytims/1fNxhEi
461212867145265152,Tue Apr 29 183811 +0000 2014|RT celiadugger Pills that cost 25 cents appear to prevent malaria in kids in West Africa MSF repts http//nytims/1lpQLnU
461172217993121792,Tue Apr 29 155639 +0000 2014|Can you tell if a person is in real pain or faking it A computer can http//nytims/1iCrHJF
461153293918814208,Tue Apr 29 144127 +0000 2014|RT cslnyt Drownings among adults 45+ are up 10 http//nytims/1lmnqKY
460895680887009280,Mon Apr 28 213748 +0000 2014|Well Reading Pain in a Human Face http//nytims/PM8s4A
460891076359122944,Mon Apr 28 211930 +0000 2014|\ Data Murky on Fertility Rates http//nytims/PM6n8B
460877318568034304,Mon Apr 28 202450 +0000 2014|Books ‘Missing Microbes’ How Antibiotics Can Do Harm http//nytims/1iy1BYl
