520192288501559296|Thu Oct 09 124120 0000 2014|RT ShirleySWangWSJ Striking numbers MT WSJ  Each day treating single Ebola patient requires 528 gall water http//onwsjcom/1ndVr3X h
520192208855904256|Thu Oct 09 124102 0000 2014|RT pharmalot Pharmalot Pharmalitte Good Morning sunshine coffee &amp; headlines http//blogswsjcom/pharmalot/2014/10/09/pharmalotpharmalittlewerereadingaboutactavisamgenandmuchmore/ pharma $ACT $AGN TKMR $AMGN $
520070403645902848|Thu Oct 09 043701 0000 2014|Human Error Cited in Spain Contagion http//onwsjcom/10SUDaO
520045766107086848|Thu Oct 09 025907 0000 2014|Researchers Arent Ruling Out Treatment Used in Dallas Case http//onwsjcom/1y9h1KG
520045765444390912|Thu Oct 09 025907 0000 2014|What New Airport Screening Measures Mean for US Travelers http//onwsjcom/1pSQNnu
520045764735549440|Thu Oct 09 025906 0000 2014|UN Health Worker in Liberia Contracts Ebola http//onwsjcom/1pSQOI1
520030447183462400|Thu Oct 09 015814 0000 2014|Dallas Ebola Patient Dies http//onwsjcom/1tDedyw
520007778543222786|Thu Oct 09 002810 0000 2014|FDA Panel Recommends Boston Scientifics Watchman Device http//onwsjcom/1sdfGz1
520007777935044608|Thu Oct 09 002810 0000 2014|Californians Split On Official Vetoing Insurer Rate Boosts http//onwsjcom/1sdfGyZ
520007777175879680|Thu Oct 09 002810 0000 2014|http//HealthCaregov Shortens Insurance Application http//onwsjcom/1sdfGyR
520007776378949632|Thu Oct 09 002809 0000 2014|Bubble Boy Syndrome Treatment Shows Promise http//onwsjcom/1BTUhfa
520007775380713472|Thu Oct 09 002809 0000 2014|US to Check West Africa Fliers for Fever http//onwsjcom/1BTUgYR
519972202704535552|Wed Oct 08 220648 0000 2014|RT louiseradnofsky http//HealthCaregov shortens application for many including mobile device users but insurers cant use it http//
519972106298474497|Wed Oct 08 220625 0000 2014|RT stefaniei New screenings to check travelers for Ebola at 5 US airports We explain how the measures will work http//onwsjcom/1rhuo2D
519941495319965697|Wed Oct 08 200447 0000 2014|RT stefaniei Calorie counts are coming down on restaurant menus study shows No word on what people actually order http//tco/xbE9G0kb
519901039097819136|Wed Oct 08 172401 0000 2014|RT JeanneWhalen Dallas Ebola patient taking experimental Chimerix drug dies $CMRX stock falls sharply http//onwsjcom/1BS08Sn
519897491651981312|Wed Oct 08 170955 0000 2014|RT pharmalot Up in Smoke Consumer groups want tougher warnings for Pfizers Chantix read the citizen petition here http//tco/ZODh26W
519866117725376513|Wed Oct 08 150515 0000 2014|RT LauraLandroWSJ Spain experience with Ebola case raises concern about weaknesses in developed countriesmedical defenses  http//tco
519852529845555200|Wed Oct 08 141116 0000 2014|RT stefaniei Fall open enrollment looms and WalMart is leading the charge on lowering employer healthcare costs this season http//t
519839744554180608|Wed Oct 08 132027 0000 2014|RT stefaniei How far can employers push the carrots and sticks associated with wellness programs  http//onwsjcom/1t1Nu4o
519837247127171073|Wed Oct 08 131032 0000 2014|RT TomBurtonWSJ Roboticsurgery on ovaries found more costly linked to more complications Columbia researchers WSJ melindabeck   http
519836989148131328|Wed Oct 08 130930 0000 2014|RT stefaniei Chimerix antiviral drug used to treat Dallas Ebola patient shows promise for another ailment study http//onwsjcom/1rgSydH
519836315618377728|Wed Oct 08 130650 0000 2014|RT pharmalot Pharmalot Pharmalittle Good Morning midweek headlines &amp; some sunshine http//blogswsjcom/pharmalot/2014/10/08/pharmalotpharmalittlewerereadingaboutallerganebolaandmuchmore/ pharma ebola $AGN $VRX 
519714333966606336|Wed Oct 08 050207 0000 2014|New York Hospitals Prep for Ebola http//onwsjcom/1tyGTbO
519674939507359745|Wed Oct 08 022535 0000 2014|http//HealthCaregov Testing to Be Confidential http//onwsjcom/1BPftTH
519674938483941377|Wed Oct 08 022535 0000 2014|Labor Department Upholds Home HealthCare Pay Rule http//onwsjcom/1BPfrLr
519674937720578048|Wed Oct 08 022534 0000 2014|Wellness Programs Get a Health Check http//onwsjcom/1s8CVdp
519674936919465987|Wed Oct 08 022534 0000 2014|Surveys Fever Checks Among Options for US Airports http//onwsjcom/1BPftTz
519674935770222595|Wed Oct 08 022534 0000 2014|Spain Rushes to Halt Ebola Threat http//onwsjcom/1BPftTy
519616247575482368|Tue Oct 07 223222 0000 2014|RT stefaniei More questions about robotic surgery  this time in gynecological surgery  http//onwsjcom/1t1EE6x melindabeckwsj
519615963751120896|Tue Oct 07 223114 0000 2014|RT stefaniei Valeant Pershing Square to boost Allergan bid by $15/shre That gets it close to $191/shre http//onwsjcom/1rfRFSF lizrhoff
519597406736744448|Tue Oct 07 211730 0000 2014|RT janetadamy The fate of Excalibur the 12yearold dog of a Spanish medical worker stricken with Ebola is prompting an uproar http//t
519568591440445440|Tue Oct 07 192300 0000 2014|RT annawmathews Insurers are testing http//HealthCaregov today But they wont be talking  or tweeting  about it http//tco/fCjD
519517695377539074|Tue Oct 07 160045 0000 2014|RT WSJPolitics New US is demanding confidentiality as insurers test new http//HealthCaregov portal http//onwsjcom/1t1jSnB by annawm
519510532722659328|Tue Oct 07 153217 0000 2014|RT janetadamy WalMarts ending health insurance for more parttime workers sbanjo http//onwsjcom/1s8uC2p
519510434529824769|Tue Oct 07 153154 0000 2014|RT TimAeppel WalMart cutting health insurance for about 30000 parttime workers http//onwsjcom/1s8uC2p via WSJ
519497491088433152|Tue Oct 07 144028 0000 2014|RT JeanneWhalen Dallas Ebola patient receiving experimental drug from $CMRX that was designed to fight smallpox &amp; other viruses http//t
519477180120956929|Tue Oct 07 131945 0000 2014|RT joewalkerWSJ Dallas Ebola patient gets Chimerix drug The outbreak has been good for some biotech stocks http//onlinewsjcom/articles/dallasebolapatientreceivingchimerixexperimentaldrug1412637687 http/
519476578787803136|Tue Oct 07 131722 0000 2014|RT stefaniei NYC joins NJ and Connecticut in requiring flu shots for preschool http//onwsjcom/10Gqew6 via WSJ
519475078128730112|Tue Oct 07 131124 0000 2014|RT TomBurtonWSJ Like flying Plane While Reading Manual Liberian rubber farm keeps Ebola away WSJ DrewHinshaw  http//tco/eTWjIFxq
519474835219832832|Tue Oct 07 131026 0000 2014|RT stefaniei CART immunotherapies show great promise in cancer  but still a long road to market http//onwsjcom/1oKoKq8 hesterplumrid
519474767427293184|Tue Oct 07 131010 0000 2014|RT pharmalot Pharmalot Pharmalittle Good Morning sunshine &amp; headlines http//blogswsjcom/pharmalot/2014/10/07/pharmalotpharmalittlewerereadingaboutpfizertevaandlotsmore/ pharma $PFE $TEVA ebola $CMRX chant
519334839753777152|Tue Oct 07 035409 0000 2014|HealthCare Worker Contracted Ebola in Spanish Hospital http//onwsjcom/ZaBuiT
519334839040741376|Tue Oct 07 035409 0000 2014|Nobel Prize Winners Discovered Inner GPS http//onwsjcom/1s3Td7q
519334838315151361|Tue Oct 07 035408 0000 2014|Sanofi Says It Disclosed ImproperPayment Claims http//onwsjcom/1s3TaIQ
519334837581148162|Tue Oct 07 035408 0000 2014|Dallas Ebola Patient Receiving Chimerix Drug http//onwsjcom/1s3Td7i
519334836964560896|Tue Oct 07 035408 0000 2014|GE Deals Head John Flannery to Lead Health Care http//onwsjcom/ZaBwr7
519216095509897216|Mon Oct 06 200218 0000 2014|RT ShirleySWangWSJ Some Parkinsons pts who got fetal cell transplants 20 yrs ago able to stop meds Is transplant worth testing again 
519215901477179395|Mon Oct 06 200132 0000 2014|RT RachelEnsignWSJ Sanofi says it told US about claims it made improper payments Scoop w/ hesterplumridge http//onwsjcom/10GaskV
519168061845549056|Mon Oct 06 165126 0000 2014|RT WSJThinkTank Chris Jacobs on higher consumer health costs because some states require insurance benefits on top of ACA mandates http
518952527446831106|Mon Oct 06 023458 0000 2014|Pakistan Reports Record Polio Cases http//onwsjcom/ZlMXwo
518952526461145088|Mon Oct 06 023458 0000 2014|Ebola Case in Dallas Points Out Flaws http//onwsjcom/1n844gb
518924306240536578|Mon Oct 06 004250 0000 2014|RT joewalkerWSJ More consolidation of hospital supplies vendors with Bectons $12B bid for CareFusion http//onlinewsjcom/articles/bectondickinsontobuycarefusionfor12billion1412542363 http//tco/
518891655483498496|Sun Oct 05 223305 0000 2014|RT AlanZibel US health officials continue to downplay Ebola fears   http//onwsjcom/Z5jYNa  sunday shift with sarahportlock
518891527305576448|Sun Oct 05 223235 0000 2014|RT TimJHanrahan Health official Idea that Ebola could come to the US over southern border or via bioterrorism very farfetched http//
518870921470574592|Sun Oct 05 211042 0000 2014|RT stefaniei SCOOP Becton Dickinson to buy CareFusion for $12B  in merger of medicalproducts makers http//onwsjcom/Z63EMa via WSJ
518523502513496066|Sat Oct 04 221011 0000 2014|US Tries to Contain Ebola Quell Fears http//onwsjcom/ZH360t
518515324954476544|Sat Oct 04 213741 0000 2014|US Tries to Contain Ebola Quell Fears http//onwsjcom/ZeWHZk
518499688161366016|Sat Oct 04 203533 0000 2014|US Tries to Contain Ebola Quell Fears http//onwsjcom/1vyillB
518181506800316416|Fri Oct 03 233113 0000 2014|US Officials Seek to Calm Public on Ebola http//onwsjcom/1vmMggz
518181505940463618|Fri Oct 03 233113 0000 2014|Medicare to Reduce Hospital Payments http//onwsjcom/1vmMgNw
518181505089032192|Fri Oct 03 233112 0000 2014|Lawsuits Rattle NursingHome Chains http//onwsjcom/1vmMgNq
518166698357432321|Fri Oct 03 223222 0000 2014|RT stefaniei Doctors companies report errors in Open Payments database Was it $155772 for travel for one doc Oops no $1975 http/
518142085673668608|Fri Oct 03 205434 0000 2014|Doctors Companies Say Physician Payment Database Contains Errors http//onwsjcom/ZCrIr0
518142084084027393|Fri Oct 03 205434 0000 2014|FDA Cracks Down on Sellers Touting Ebola Treatments http//onwsjcom/1raIH9j
518137153474555904|Fri Oct 03 203458 0000 2014|RT Loftus There are errors in the new US database of payments to doctors by drug device makers http//onwsjcom/1BDPdM1 via WSJ joewalk
518083171645419520|Fri Oct 03 170028 0000 2014|RT nataliewsj Essentials oils sellers are promoting concoctions to prevent Ebola on Pinterest  The FDA is not impressed http//tco/Gx
518076862392963072|Fri Oct 03 163524 0000 2014|RT stefaniei Faces of the ACA http//graphicswsjcom/HealthProfiles/  How has the health law affected you Share your stories here http//tco/dKz3xaOq
518071351039369216|Fri Oct 03 161330 0000 2014|Vascular Biogenics Revives US IPO http//onwsjcom/Z0JvXX
518041555027107841|Fri Oct 03 141506 0000 2014|RT nathankoppel All but seven Texas abortion clinics face immediate closure following court ruling http//onwsjcom/1mX7zpK via WSJ
518029112976609280|Fri Oct 03 132539 0000 2014|RT DanaMattioli An inversion deal bites the dust Salix Cosmo cancel inversion deal http//onwsjcom/1yBBCIN
518027260268642305|Fri Oct 03 131818 0000 2014|RT stefaniei Health insurance cancellations round 2 But much less widespread than last year http//onwsjcom/1mWH2Zz
518027168497303553|Fri Oct 03 131756 0000 2014|RT jenniferlevitz Providence man infected by Ebola in Liberia WSJ talked to him and his family He is set to be transported home Sun ht
518026604409536512|Fri Oct 03 131541 0000 2014|RT TomBurtonWSJ FDA cracks down on companies selling essential oils to treat Ebola cancer scary stuff WSJ natalieandrews  http
518026524260593665|Fri Oct 03 131522 0000 2014|RT pharmalot Up and Down the Ladder Job Changes the latest comings &amp; goings recognize anyone http//blogswsjcom/pharmalot/2014/10/03/upanddowntheladderthelatestcomingsandgoingsatnovoprotalixand/ pharma $NOVO $
518026428190064640|Fri Oct 03 131459 0000 2014|RT pharmalot Pharmalot Pharmalittle As the Weekend Nears daydreams &amp; headlines http//blogswsjcom/pharmalot/2014/10/03/pharmalotpharmalittleastheweekendnearswerereadingaboutsalixzimmerand/ pharma $SLXP $AGN $ACT $LLY $
517890197300580352|Fri Oct 03 041339 0000 2014|US Ebola Screening Widens http//onwsjcom/1mXq4uf
517780717846003712|Thu Oct 02 205837 0000 2014|Wipe That Smog Off Your Face http//onwsjcom/ZwZi1y
517760487841603584|Thu Oct 02 193814 0000 2014|RT stefaniei Drug and device makers payments to docs What is the money for Heres a partial breakdown http//onwsjcom/1mSueUd http//t
517759796817453057|Thu Oct 02 193529 0000 2014|RT saraheneedleman Employers w/100 workers must offer affordable health care soon; An PigglyWiggly chain preps http//onwsjcom/1mScSqw 
517759472446758912|Thu Oct 02 193412 0000 2014|RT TomBurtonWSJ How Ebola came to the US Tinroof shacks a pregnant teen and a taxi back from the hospital WSJ DrewHinshaw  http
517734043459526656|Thu Oct 02 175309 0000 2014|RT stefaniei Faces of the ACA; Business owner Tommy Cain and his workers discuss signing up for company health plans Great video http/
517718062532165632|Thu Oct 02 164939 0000 2014|RT JeanneWhalen Vaccine makers race to stifle a swine virus that has roiled the US meat industry http//onwsjcom/1mRIk8d via WSJ
517703081723957250|Thu Oct 02 155007 0000 2014|RT stefaniei How to medical workers in Africa suit up to treat Ebola patients See our video  http//onwsjcom/1rJ10aH http//tco/v3do6rm
517687671716851712|Thu Oct 02 144853 0000 2014|RT JeanneWhalen “It’s so complicated that it’s almost useless Pharmalot on the problems with the Open Payments database http//tco/N
517682573716516866|Thu Oct 02 142838 0000 2014|RT pharmalot So Much for Transparency the CMS Open Payments system toggles the mind a fine mess http//blogswsjcom/pharmalot/2014/10/02/somuchfortransparencyopenpaymentsdatabasetogglesthemind/ pharma tran
517682089496694784|Thu Oct 02 142642 0000 2014|RT Loftus More on sunshineact Payments show range of doctors ties with industry http//onwsjcom/1mSueUd via WSJ
517681763842531328|Thu Oct 02 142525 0000 2014|RT stefaniei Faces of the ACA See how our entrepreneurs are faring with their plans to expand amid rising healthcare premiums http//
517681060512288768|Thu Oct 02 142237 0000 2014|RT TomBurtonWSJ Will the powerful  painkiller Zohydro made into a goopy gel inside a capsule be less abused by addicts WSJ  http//t
517680321404633089|Thu Oct 02 141941 0000 2014|RT JeanneWhalen Delaying gluten in diet doesnt prevent celiac disease studies find by mccabecaitlin http//onwsjcom/1rJxcux
517680180836696065|Thu Oct 02 141907 0000 2014|RT stefaniei Faces of the ACA Our smallbusiness owner educates workers about their health plans which many find unaffordable http//t
517678092853473280|Thu Oct 02 141050 0000 2014|RT ronwinslow A onceayear diabetes treatment New implantable pump could  improve compliance My story  http//matsdowjonescom/jpml/SB12753519717962134038504580188590748336952jpml
517587243251150848|Thu Oct 02 080949 0000 2014|US Monitors Ebola Patients Contacts http//onwsjcom/1rLnnMF
517514082757271553|Thu Oct 02 031906 0000 2014|US Monitors Ebola Patients Contacts http//onwsjcom/YQkA9v
517514080928546816|Thu Oct 02 031906 0000 2014|Bosses Face Affordable Care Act Deadline http//onwsjcom/YQkA9r
517514080131629056|Thu Oct 02 031906 0000 2014|http//HealthCaregov Delays Web Host Switch http//onwsjcom/1rKuiWc
517514079435358209|Thu Oct 02 031906 0000 2014|Payments Show Range of Doctors Ties With Industry http//onwsjcom/1rKugxw
517514078592311296|Thu Oct 02 031905 0000 2014|California Catholic Leaders Challenge State Health Rule on Abortion http//onwsjcom/1rKuiFS
517447328165539840|Wed Oct 01 225351 0000 2014|RT louiseradnofsky What will http//HealthCaregov be like this year Feds stick with web host they know; waiting rooms might be back ht
517381900089192449|Wed Oct 01 183352 0000 2014|RT ShirleySWangWSJ Endo settles vaginal mesh cases http//onwsjcom/1qT4SAO More on mesh http//onwsjcom/1kdfJTs http//onwsjcom/1iGM7yC ht
517380967120773121|Wed Oct 01 183009 0000 2014|Q&amp;A on Ebola going on now on our Facebook page with betswrites https//wwwfacebookcom/wsj/posts/10152814628008128
517308772843540481|Wed Oct 01 134317 0000 2014|RT stefaniei Passengers on flight with US Ebola patient in Dallas not at risk says CDC http//onwsjcom/1rEstsw
517308515204231169|Wed Oct 01 134215 0000 2014|RT TomBurtonWSJ The first NIH grants in the Presidents BRAIN initiativeways of imaging brain and ways cells talk My story WSJ htt
517307581707325440|Wed Oct 01 133833 0000 2014|RT stefaniei Some doctors and companies  dispute accuracy of Open Payments database http//onwsjcom/1mMfPZF loftus et al
517307336411869184|Wed Oct 01 133734 0000 2014|RT Loftus Expect Justice Department to comb new physicianpayments database for industry ties that raise red flags http//tco/A5IByeOya
517307151816331264|Wed Oct 01 133650 0000 2014|RT pharmalot Pharmalot Pharmalittle Good Morning midweek coffee &amp; headlines http//blogswsjcom/pharmalot/2014/10/01/pharmalotpharmalittlewerereadingaboutjjshortsalesandlotsmore/ pharma $JNJ $NWBO $ENDP $GILD 
517306868381659138|Wed Oct 01 133543 0000 2014|Doctors Net Billions From Drug Firms http//onwsjcom/1nKRt3k
517306867660226561|Wed Oct 01 133543 0000 2014|Endo to Settle Vaginal Mesh Legal Claims http//onwsjcom/YTotu0
517090137164226560|Tue Sep 30 231430 0000 2014|RT WSJ How the latest Ebola crisis unfolded http//onwsjcom/1rrsyCh http//pbstwimgcom/media/Byz2vZlIcAAP7Ppng
517065066941001728|Tue Sep 30 213453 0000 2014|RT stefaniei Health officials confirm 1st case of Ebola diagnosed in US Patient being treated in isolation in Dallas http//tco/9602o
517031716796780544|Tue Sep 30 192221 0000 2014|RT Loftus Drug device makers paid at least $35B to doctors in last 5 months of 2013 says new database http//onwsjcom/1mMfPZF via WSJ
517010603760975873|Tue Sep 30 175828 0000 2014|RT WSJThinkTank Drew Altman on diminishing public attention to the Affordable Care Act as a political story http//onwsjcom/1nG8xr9 http
516969151596752896|Tue Sep 30 151345 0000 2014|RT janetadamy Enrolled on http//HealthCaregov Ensure by today your incomes right Payback looms for those with wrong subsidy http//
516949381246091264|Tue Sep 30 135511 0000 2014|RT stefaniei Today is the deadline 300000 health law enrollees must square their income with IRS data or risk losing subsidies http//
516947195053223936|Tue Sep 30 134630 0000 2014|RT LauraLandroWSJ My column today on  programs to keep weightloss surgery patients from backsliding into bad eating habits http//tco/
516946965960355840|Tue Sep 30 134535 0000 2014|RT pharmalot Does the Open Payments database distort what docs get for research some academics say yes heres why http//tco/glBAwKkY5
516942855047499776|Tue Sep 30 132915 0000 2014|RT stefaniei Can you test for compassion Growing use of workplace personality tests draws scrutiny http//onwsjcom/1u7pDP6
516938838166740992|Tue Sep 30 131317 0000 2014|RT ShirleySWangWSJ Interesting AmyDMarcus piece on how researchers are recruiting patients not just to be in trials but to design them h
516938619442176000|Tue Sep 30 131225 0000 2014|RT rddysum Tis the season for germs And theyre all over your office This weeks Your Health  http//onwsjcom/1u6YZWw via WSJ
516937466742571008|Tue Sep 30 130750 0000 2014|RT stefaniei Pediatricians back implantable devices like IUDs over the pill to prevent teen pregnancies jeannewhalen http//tco/finwl
516937402125127680|Tue Sep 30 130735 0000 2014|RT pharmalot Pharmalot Pharmalittle Good Morning another shiny day so far http//blogswsjcom/pharmalot/2014/09/30/pharmalotpharmalittlewerereadingaboutpfizeramagandmuchmore/ pharma $PFE patents sex $AMA
516923724075773952|Tue Sep 30 121314 0000 2014|Planet Geek Meets Planet Jock http//onwsjcom/YGuJ8D
516786885457223681|Tue Sep 30 030929 0000 2014|Germs Thrive at Work Too http//onwsjcom/1mJ1BIY
516769929538715648|Tue Sep 30 020206 0000 2014|New Cancer Drugs Get Boost From Latest Trial Results http//onwsjcom/YJkqjN
516769928876023808|Tue Sep 30 020206 0000 2014|Medical Devices Lack Safety Evidence Study Finds http//onwsjcom/1mIOSGg
516760596927115265|Tue Sep 30 012501 0000 2014|Hundreds of Thousands Face Health Law Subsidy Deadline http//onwsjcom/1mIIcIa
516760596113408000|Tue Sep 30 012501 0000 2014|Californias New Law Cracks Down on Sexual Assault on College Campuses http//onwsjcom/1mIIcI9
516760595438112768|Tue Sep 30 012501 0000 2014|Campus Sexual Assaults Draw Greater Scrutiny http//onwsjcom/1mIIcI2
516709006526930944|Mon Sep 29 220001 0000 2014|RT TomBurtonWSJ Apparently we have to tell the IRS the truth Thousands may lose health subsidies under ACA WSJ StephArmour1  http//
516708711302451200|Mon Sep 29 215851 0000 2014|RT JeanneWhalen Docs should prescribe IUDs or contraceptive implants 2 sexually active teens bc theyre most effective AAP says http//
516675076973137920|Mon Sep 29 194512 0000 2014|RT hesterplumridge New cancer drugs get boost from latest trial results  more data from ESMO on immunotherapy combinations http//tco/O
516674866955968512|Mon Sep 29 194422 0000 2014|RT StephArmour1 Hundreds of Thousands Face Health Law Subsidy Deadline http//onwsjcom/1wR7Fjh
516674739398799360|Mon Sep 29 194351 0000 2014|RT TomBurtonWSJ Many medical devices cleared by FDA lack public proof of safety and efficacy researchers find My story at WSJ http//t
516591574508392449|Mon Sep 29 141323 0000 2014|RT JamieHeller Allergan reiterates its opposition to Valeants bid But its the possible Salix takeover that has investors griping http
516591320635572224|Mon Sep 29 141223 0000 2014|RT janetadamy Why this falls health law insurance enrollment is more complicated than last year stepharmour1 louiseradnofsky http//tc
516584788116111361|Mon Sep 29 134625 0000 2014|RT stefaniei Watson gets a frenemy Amelia is another foray into artificial intelligence using cognitive computing http//tco/PBF2g04
516584699289169920|Mon Sep 29 134604 0000 2014|RT Loftus ICYMI As doctors lose clout drug firms redirect sales call http//onwsjcom/1srMG8u via WSJ jonathanrockoff
516584088875319296|Mon Sep 29 134339 0000 2014|RT jonathanrockoff Patients and parents are hacking medical devices to make them more helpful http//onwsjcom/ZYHvQV by katelinebaugh
516576404952342529|Mon Sep 29 131307 0000 2014|RT LauraLandroWSJ Breaking bad habitTricks for overcoming a bingewatching addiction Hint watch only 3/4 of each episode http//tco/L
516576200798765056|Mon Sep 29 131218 0000 2014|RT MaryLuWSJ As Ebola epidemic accelerates US troops get off to a slow start combating it drewfhinshaw &amp; betswrites http//tco/bz
516575746945720320|Mon Sep 29 131030 0000 2014|RT stefaniei Health law enrollment part II is coming soon Supporters gearing up for new challenges  http//onwsjcom/1qLwM1z
516574911570395136|Mon Sep 29 130711 0000 2014|RT pharmalot Some patients are hacking their medical devices so they can be used in ways not yet approved by the FDA http//tco/eeTMAvt2
516400820540018688|Mon Sep 29 013524 0000 2014|US Troops Battling Ebola Get Off to Slow Start in Africa http//onwsjcom/1nv1QYI
516400819717939200|Mon Sep 29 013524 0000 2014|HealthCoverage Expansion Gets Tougher http//onwsjcom/1uVvO6F
515898289057980416|Sat Sep 27 161831 0000 2014|RT JeanneWhalen Fascinating techie parents of diabetics are engineering improvements 2 glucose monitors Device makers cant keep up htt
515621435994566656|Fri Sep 26 215824 0000 2014|RT stefaniei Citizen science Diabetes patients families hack into their glucose devices to access dataand make it more useful http/
515619512800907265|Fri Sep 26 215046 0000 2014|Citizen Hackers Concoct Upgrades for Medical Devices http//onwsjcom/1uNQJbZ
515598175433158657|Fri Sep 26 202559 0000 2014|RT jonathanrockoff T Rowe Price tells Allergan board We want a vote http//onwsjcom/ZYvWsM DaveCBenoit $AGN $VRX $ACT $SLXP
515528837107843072|Fri Sep 26 155027 0000 2014|RT stefaniei Mustsee WSJ TV GSKs Deirdre Connelly on selling medicines to a changing healthcare system http//onwsjcom/1sufZr6
515505824782123008|Fri Sep 26 141900 0000 2014|RT stefaniei Doctors arent always in the drivers seat in prescribing drugs so pharma is shifting sales pitches to the hospitals http/
515503994379456512|Fri Sep 26 141144 0000 2014|RT WSJ Commuting by bike grew by 62% between 2000 and 2013 in the US The rise of bikefriendly housing http//onwsjcom/1ysEJCI
515503113240084480|Fri Sep 26 140814 0000 2014|RT stefaniei Hospitals departing Medicares Pioneer ACO program say they saved money just not enough http//onwsjcom/1qzTSYT melindabec
515494275207815168|Fri Sep 26 133307 0000 2014|RT WSJThinkTank Nearly a third of gay and bisexual men have never been tested for HIV http//onwsjcom/1pufkhu by Kaisers DrewAltman htt
515375029328949248|Fri Sep 26 053916 0000 2014|Ebola Death Toll Nears 3000 http//onwsjcom/1n6vOCo
515342348184584192|Fri Sep 26 032925 0000 2014|Obama World Lagging in Ebola Response http//onwsjcom/YflzQ4
515285192223625216|Thu Sep 25 234218 0000 2014|A Medicare Program Loses More HealthCare Providers http//onwsjcom/1vklnek
515274965755912193|Thu Sep 25 230139 0000 2014|RT stefaniei More hospital systems depart Medicares Pioneer ACO program http//onwsjcom/1qzTSYT
515222467473080320|Thu Sep 25 193303 0000 2014|RT stefaniei US dedicates $22M to research nondrug options for chronic pain among military personnel and vets http//onwsjcom/ZeUHRv
515213274087174146|Thu Sep 25 185631 0000 2014|RT janetadamy Verrillis in spotlight with Holder leaving Remember those broccoli questions he took in the ACA SCOTUS case brohttp//on
515208055210770432|Thu Sep 25 183547 0000 2014|RT WSJThinkTank Only a third of gay and bisexual men know that HIV infections are rising among this group http//onwsjcom/1pufkhu http//
515148346303205376|Thu Sep 25 143831 0000 2014|RT leHotz Robopharma DHL Drone to Deliver Medicine     http//livewsjcom/video/dhldronetodelivermedicine/D39D0415DF8840FEAFF25B347B589DD4html via WSJ
515145859949162496|Thu Sep 25 142838 0000 2014|RT stefaniei Big Pharma is shifting its sales pitch to hospital systems Its all about getting on the formulary http//onwsjcom/1srMG8u
