458710020121976832|Tue Apr 22 205245 0000 2014|RT JamieHeller jonathanrockoff on how one wave of pharma mna could jumpstart another http//onwsjcom/1lB6VsP via WSJMoneyBeat
458692166895042560|Tue Apr 22 194149 0000 2014|RT stefaniei Q&amp;A What the deal frenzy says about big pharma as companies scale up in core competencies via edsilverman http//tco/mnQ
458691515372802048|Tue Apr 22 193914 0000 2014|RT TomBurtonWSJ Chinese medicines used in chronic disease by of all places the Cleveland Clinic WSJ rddysum http//onwsjcom/1nlHCie
458690989277085698|Tue Apr 22 193708 0000 2014|RT Loftus More on Lilly paying $54 billion for Novartis animalhealth unit http//onwsjcom/1mA9xee $LLY $NVS
458622930159955968|Tue Apr 22 150642 0000 2014|RT LauraLandroWSJ Bionic diagnostics In the future digital implants sensors tattoos could take vital signs deliver meds by LeHotz h
458604889472790528|Tue Apr 22 135500 0000 2014|RT stefaniei Why Glaxo is exiting cancer drugs at a time when oncology is a hot fastgrowing area via hesterplumridge http//tco/hGvi
458600780585783296|Tue Apr 22 133841 0000 2014|RT martafalconiWSJ Novartis overhauls product portfolio in series of deals valued at more than $25 billion http//onwsjcom/1eYC4Yk
458600656484728832|Tue Apr 22 133811 0000 2014|RT Loftus With Novartis deal Eli Lilly casts line into aquaculture vaccines for fish farms $LLY $NVS
458497914277347328|Tue Apr 22 064955 0000 2014|Novartis Buys Glaxo Unit for $145 Billion http//onwsjcom/1jtSyUs
458379104677404672|Mon Apr 21 225749 0000 2014|Medtronic Can Sell Heart Valve After Appeals Court Delays Ban http//onwsjcom/1eXepYq
458379104060837888|Mon Apr 21 225749 0000 2014|Ackman Valeant Set Sights on Botox Maker http//onwsjcom/1jsyHov
458370669932457985|Mon Apr 21 222418 0000 2014|RT stefaniei Further on Valeant/Pershing Square pursuit of Allergan Unusual alliance of activist investor and corporate acquirer http/
458345071147237376|Mon Apr 21 204235 0000 2014|RT joewalkerWSJ Medtronic wins delay of court injunction in its patent dispute with Edwards $MDT $EW
458344748852731905|Mon Apr 21 204118 0000 2014|RT stefaniei Ackman Valeant team up to pursue takeover of Allergan Great scoop by DaveCBenoit  DanaMattioli jonathanrockoff http//t
458271877115691009|Mon Apr 21 155144 0000 2014|RT WSJ Last year Lee Ann Yanni was wounded at the BostonMarathon bombing Today she is running the race http//onwsjcom/1h4KxYO
458241024989880320|Mon Apr 21 134908 0000 2014|RT stefaniei Whats on that dollar bill in your hand DNA analysis identified 3000 types of bacteria on paper money LeHotz http//tco
458235675872354305|Mon Apr 21 132753 0000 2014|RT leHotz Spitpowered microdevices putting your drool to work    http//onlinewsjcom/news/articles/SB10001424052702304810904579507671020366130modWSJhpssectionshealth&mgreno64wsj
458230754540277761|Mon Apr 21 130820 0000 2014|RT joewalkerWSJ ICYMI Elderly patients caught in middle of patent dispute over new heart valve technology http//onwsjcom/1eJ9IkI $EW $MD
458230448846827522|Mon Apr 21 130707 0000 2014|RT jenniferlevitz Fourtime Boston Marathon champ Bill Rodgers tells WSJ he made some serious lifestyle changes in order to win  http//t
458230378030190592|Mon Apr 21 130650 0000 2014|RT stefaniei Boston Marathon returns with some of the injured in last years bombing planning to cross the finish line themselves http/
457354820605575168|Sat Apr 19 030741 0000 2014|Why You Shouldnt Put Your Money Where Your Mouth Is http//onwsjcom/1jgqgg5
457354819959656449|Sat Apr 19 030740 0000 2014|Saliva Fuels a Tiny Medical Device http//onwsjcom/1eJYk8a
457153571616989184|Fri Apr 18 134759 0000 2014|RT janetadamy Kudos jenniferlevitz for first reporting cancer risks of morcellator devices on fibroids Now FDA says dont use http//t
456989200215076865|Fri Apr 18 025450 0000 2014|Obama HealthPlan SignUps at 8 Million http//onwsjcom/1kGsIAI
456989199590113281|Fri Apr 18 025450 0000 2014|FDA Warns on Popular Hysterectomy Procedure http//onwsjcom/1jaT0YE
456989198080151553|Fri Apr 18 025449 0000 2014|European Agency Warns of More Tampered Drugs http//onwsjcom/1jaSYQL
456639275774119936|Thu Apr 17 034421 0000 2014|GOP Fall Strategy Slam Health Law http//onwsjcom/1tcvh1a
456452717138161665|Wed Apr 16 152302 0000 2014|RT TimJHanrahan Key ACA question Will slowdown in US healthcare spending growth persist http//onwsjcom/1nbm486 by davidmwessel http/
456446024396341248|Wed Apr 16 145627 0000 2014|RT janetadamy New Hampshires rocky healthlaw rollout poses a test for Sen Jeanne Shaheen hookjan http//onwsjcom/1evHv0N
456250896293187584|Wed Apr 16 020105 0000 2014|Sales of J&amp;Js Hepatitis Drug Soar http//onwsjcom/1iWUFjp
456250895634681857|Wed Apr 16 020104 0000 2014|Glaxo Wins US Approval for Diabetes Treatment Albiglutide http//onwsjcom/1ew7CVt
456221061160259584|Wed Apr 16 000231 0000 2014|When Spine Implants Cause Paralysis Who Is to Blame http//onwsjcom/1kvnZla
455895381113446400|Tue Apr 15 022823 0000 2014|The Science of Sore Legs http//onwsjcom/1erNnbn
455863635051438080|Tue Apr 15 002214 0000 2014|Early Hand Preference Tied to Language http//onwsjcom/Q83K1R
455863634300645377|Tue Apr 15 002214 0000 2014|Bag Those Bags http//onwsjcom/1iPMqFB
455863633566633984|Tue Apr 15 002214 0000 2014|New Opinion on Tub Births http//onwsjcom/Q83HTN
455863632899751936|Tue Apr 15 002214 0000 2014|Why We Keep Losing Our Keys http//onwsjcom/Q83HTM
455513929775468545|Mon Apr 14 011238 0000 2014|OddHour Workers Face Loss of Employer Health Plans http//onwsjcom/1sYaHl2
454816860861513728|Sat Apr 12 030244 0000 2014|Doctors Discounted Early Hints of Popular Hysterectomy Procedures Risks http//onwsjcom/1sP560y
454714263333273600|Fri Apr 11 201503 0000 2014|RT TimJHanrahan If you missed it  &gt; Video Sebelius’s Farewell Remarks Hit by Glitch http//onwsjcom/1qI7m5Q via WSJwashington
454703396516528128|Fri Apr 11 193152 0000 2014|RT jonathanrockoff J&amp;J ending development of PurTox botulinum toxin to focus on breast surgery biz was to challenge Botox $JNJ $AGN http
454675071324655616|Fri Apr 11 173919 0000 2014|RT annawmathews CMS released marketmoving data on an industry call and stocks moved after  http//onlinewsjcom/news/articles/SB10001424052702304512504579491881406165124modWSJhpLEFTTopStories&mgreno64wsj
454618691762941952|Fri Apr 11 135517 0000 2014|RT janetadamy Goodbye Kathleen Sebelius Inside her departure and whats next for Sylvia Mathews Burwell http//onwsjcom/1sIuvbY
454618636431687681|Fri Apr 11 135504 0000 2014|RT stefaniei Sebelius exit wont close bitter partisan divide over health law http//onwsjcom/1izPJ3y geraldfseib
454616061191929856|Fri Apr 11 134450 0000 2014|RT joewalkerWSJ Breakthrough in quest to grow body parts labmadevagina transplants a success http//onwsjcom/1sIJ1AK
454615990564057088|Fri Apr 11 134433 0000 2014|RT stefaniei Early access to govt analysis of Medicare Advantage rates roiled insurer stocksagain annawmathews &amp; Brody Mullins http/
454615873748480000|Fri Apr 11 134405 0000 2014|RT WSJ Video Scientists transplant labmade sexual organs http//onwsjcom/1ggyEi7 http//pbstwimgcom/media/Bk78Zo1IIAAid3vpng
454459968456904704|Fri Apr 11 032434 0000 2014|Breakthrough in Quest to Grow Body Parts http//onwsjcom/1hnJxzs
454430729573629952|Fri Apr 11 012823 0000 2014|Kathleen Sebelius to Resign HHS Post http//onwsjcom/1izBLPh
454373967365943297|Thu Apr 10 214250 0000 2014|RT stefaniei Medicare data can throw spotlight on potential abuses Some docs who got big payments have had runins with the law http//
454315012719673344|Thu Apr 10 174834 0000 2014|RT CorbettDooren Health insurance enrollment has hit 75 million Sebelius says http//onwsjcom/1eoK0SS
454314891151958016|Thu Apr 10 174805 0000 2014|RT stefaniei MustSee WSJ TV cdweaver explains why some doc turn up as big billers in the Medicare data; Some of its overhead http//
454311580738813952|Thu Apr 10 173456 0000 2014|RT cdweaver How do docs become top Medicare billers Fraud dogooding or any number of other things http//onlinewsjcom/news/articles/SB10001424052702303873604579492012568434456modWSJhpRightTopStories&mgreno64wsj
454288446891491328|Thu Apr 10 160300 0000 2014|RT Loftus Merck is in the race for nextgeneration Hepatitis C regimen $MRK $GILD $ABBV $BMY $JNJ http//onwsjcom/OIUwaX
454288018321707008|Thu Apr 10 160118 0000 2014|RT TomBurtonWSJ Evaluation by Cochrane Collaboration questions Tamiflus power against flu epidemics WSJ hesterplumridge http//tco/d
454287965477683201|Thu Apr 10 160105 0000 2014|RT stefaniei Look up your doc in the Medicare payment database but take it with a grain of salt Our tool  http//projectswsjcom/medicarebilling/standalone1
454287889267179520|Thu Apr 10 160047 0000 2014|RT stefaniei Closer look at Medicare doc data reveals how sheer reimbursement $$ dont tell the whole picture about doctors  http//tco
454256823374471168|Thu Apr 10 135721 0000 2014|RT janetadamy Mich oncologist gets $10 mil from Medicare RI anesthesiologist gets $35 mil Whats it mean Data has limits http//t
454070086320398336|Thu Apr 10 013519 0000 2014|DoctorPay Trove Shows Datas Limits http//onwsjcom/1kMA5op
454070085670289408|Thu Apr 10 013519 0000 2014|Study Questions Tamiflus Effectiveness Against Pandemics http//onwsjcom/1kMA7wm
453973371509026816|Wed Apr 09 191100 0000 2014|RT cdweaver Important re Medicare dataIts partial payments not profits Big billers may have high overhead and small margins http//t
453959216148254720|Wed Apr 09 181445 0000 2014|RT JeanneWhalen Opthalmologists are some of the biggest Medicare billers in part due to $$ drugs like Lucentis from Roche/Novartis  http
453959069314080770|Wed Apr 09 181410 0000 2014|RT stefaniei Medicare paid one Florida ophthalmologist more than $20 million in 2012 http//onwsjcom/1iuhnis
453891451232210945|Wed Apr 09 134529 0000 2014|RT cdweaver Go see what your doctor got paid by Medicare in 2012 http//projectswsjcom/medicarebilling/
453889314905419776|Wed Apr 09 133700 0000 2014|RT michaelsiconolf A 35year fight Efforts by WSJ and others to require the US to release Medicarebilling data finally bear fruit http
453889257216966656|Wed Apr 09 133646 0000 2014|RT LauraLandroWSJ Live Obokata Speaks About Stem Cell Research Probe http//onwsjcom/1syGRmY via japanrealtime
453888883126960128|Wed Apr 09 133517 0000 2014|RT CorbettDooren Healthcare law economy boost ranks of the insured http//onwsjcom/1egCzx0
453888799232512000|Wed Apr 09 133457 0000 2014|RT stefaniei New data on Medicare doctors offers window into physician practices 1% of providers accounted for 14% of billing http//t
453754229702668288|Wed Apr 09 044013 0000 2014|Small Slice of Doctors Account for Big Chunk of Medicare Costs http//onwsjcom/1kIOVwb
453724585813217280|Wed Apr 09 024225 0000 2014|HealthCare Law Economy Boost Ranks of the Insured http//onwsjcom/PPbSUM
453605554184028160|Tue Apr 08 184926 0000 2014|RT jonathanrockoff JeanneWhalen on a Turkish company that prosecutors say sold fake cancer meds &amp;  patient who died after taking one ht
453594194326872064|Tue Apr 08 180417 0000 2014|RT joewalkerWSJ People paralyzed by spinalcord injuries regain voluntary movement with help of spinal cord stimulator http//tco/9TriZE
453546026360922112|Tue Apr 08 145253 0000 2014|RT edsilverman How Much Express Scripts Pushes Back Against Sovaldi Pricing With A New Payer Coalition http//blogswsjcom/corporateintelligence/2014/04/08/unsustainableforourcountryexpressscriptscallsoutpriceymeds/ pharma $G
453538126292865024|Tue Apr 08 142130 0000 2014|RT TomBurtonWSJ There is a subset of women who should be taking lowdose aspirin during pregnancy says a key US task force WSJ http
453530428725809152|Tue Apr 08 135055 0000 2014|RT annawmathews Medicare Advantage rates to go up CMS says; analysts and industry disagree http//onlinewsjcom/news/articles/SB10001424052702303456104579487921183118250modWSJhpsMIDDLEVideoTop&mgreno64wsj
453526627402919936|Tue Apr 08 133548 0000 2014|RT stefaniei Tracing the tortuous path of fake cancer drugs US officials point to Turkish exporter via JeanneWhalen http//tco/Qj1i
453522138621046784|Tue Apr 08 131758 0000 2014|RT LauraLandroWSJ When teens share earbuds do they also share germs and disease One expert weighs in WSJ Burning Question http//tco/
453521061511172096|Tue Apr 08 131341 0000 2014|RT rddysum Would you go to a retail health clinic with a nurse practitioner instead of your doctor My Your Health column http//tco/
453521005437517825|Tue Apr 08 131328 0000 2014|RT stefaniei Tantalizing new hope for paraplegics with the help of electrical stimulation and  PT Much more work to do though http//
453506403290734593|Tue Apr 08 121526 0000 2014|Scientists Progress in Quest to Grow Muscle Tissue http//onwsjcom/1kG4WCQ
453357223062667265|Tue Apr 08 022239 0000 2014|The Power of the Earliest Memories http//onwsjcom/1e6ylHT
453357222165495809|Tue Apr 08 022239 0000 2014|Panel Backs Aspirin Use for Some Pregnant Women http//onwsjcom/OuCcCn
453357220579639296|Tue Apr 08 022239 0000 2014|Medicare Agency Says Payments to Insurers Will Rise in 2015 http//onwsjcom/1e6yivN
453357219921145856|Tue Apr 08 022238 0000 2014|To Do Celebrate Your Spouse Today http//onwsjcom/1e6ylHH
453357219187138560|Tue Apr 08 022238 0000 2014|When Drugstores Play Doctor http//onwsjcom/1e6yivJ
453208332007133184|Mon Apr 07 163101 0000 2014|RT WSJwashington What do Oregon Maryland Mass Nevada Hawaii have in common Big healthexchange problems http//blogswsjcom/fivethings/2014/04/04/5thingsaboutstateswithproblemplaguedhealthexchanges/ via 
453171951197245440|Mon Apr 07 140627 0000 2014|RT stefaniei Promise of CDK inhibitors gets a boost from Pfizer Lilly news in breast cancer http//onwsjcom/OmWayJ jonathanrockoff ro
453165641684762625|Mon Apr 07 134123 0000 2014|RT stefaniei In the crosshairs planned cuts for Medicare Advantage get pushback even from Dems  http//onwsjcom/1e4QEgL
453165131258937344|Mon Apr 07 133921 0000 2014|RT LauraLandroWSJ New Pfizer Lilly drugs that target proteins show promise in slowing BreastCancer by jonathanrockoff ronwinslow http
453012484895424512|Mon Apr 07 033247 0000 2014|Some Democrats Fight Obama Over Medicare http//onwsjcom/Opohxx
453012484203360256|Mon Apr 07 033247 0000 2014|Pfizer Lilly Drugs Show Promise in Slowing Breast Cancer http//onwsjcom/Opohxp
452232119364759552|Fri Apr 04 235153 0000 2014|Hackathons Aim to Solve Health Cares Ills http//onwsjcom/1qanEG1
452203430556483585|Fri Apr 04 215754 0000 2014|RT TimJHanrahan We check in on the 5 states with the most troubled online health exchanges http//blogswsjcom/fivethings/2014/04/04/5thingsaboutstateswithproblemplaguedhealthexchanges/ by CorbettDooren http
452200836681465856|Fri Apr 04 214735 0000 2014|RT LauraLandroWSJ Five things about states with problem plagued health exchanges by CorbettDooren in WSJ  http//blogswsjcom/fivethings/2014/04/04/5thingsaboutstateswithproblemplaguedhealthexchanges/
452076602269401088|Fri Apr 04 133355 0000 2014|RT jonathanrockoff GlaxoSmithKline cuts staff in China as it heightens scrutiny of expense reports amid China probe http//tco/ApbwXEdI
452072873579282432|Fri Apr 04 131906 0000 2014|RT stefaniei Bad news for potato chips More people are choosing fresh foods over prepared and packaged fare serenangwsj  http//tco/S
452071689036509184|Fri Apr 04 131424 0000 2014|RT LauraLandroWSJ Healthlaw tweak that would redefine fulltime worker gains bipartisan traction by kristinapet http//onwsjcom/Og7a0T
452071495695863808|Fri Apr 04 131338 0000 2014|RT stefaniei States Grapple With Fixing ProblemPlagued Health Exchanges CorbettDooren  http//onwsjcom/1haA3s8
451929292222369792|Fri Apr 04 034834 0000 2014|IMS Health Raises $13 Billion in IPO http//onwsjcom/1lt4g5c
451929291475795969|Fri Apr 04 034834 0000 2014|States Grapple With Fixing ProblemPlagued Health Exchanges http//onwsjcom/1jHLJ5i
451907969291014144|Fri Apr 04 022350 0000 2014|FDA Approves Injection to Counteract Painkiller Overdose http//onwsjcom/1seQCH1
451907968389238784|Fri Apr 04 022350 0000 2014|Novartis Shakes Up Japan Ranks http//onwsjcom/1seQEOX
451893332650647552|Fri Apr 04 012540 0000 2014|Young Workers Dont Flock to Employer Health Plans http//onwsjcom/1pXBcCY
451893331652386816|Fri Apr 04 012540 0000 2014|HealthLaw Tweak Gains Bipartisan Traction http//onwsjcom/1pXBeuu
451826974139613184|Thu Apr 03 210159 0000 2014|RT edsilverman Heres One More Thing Drugmakers Wont Do On Social Media http//blogswsjcom/corporateintelligence/2014/04/03/onethingdrugcompanieswontdoonsocialmedia/KEYWORDSedsilverman pharma socpharm
451826711567806464|Thu Apr 03 210057 0000 2014|RT TomBurtonWSJ FDA approves an injection Evzio that family members could use to reverse an overdose of narcotic painkillers WSJ http
451715121212293120|Thu Apr 03 133732 0000 2014|RT stefaniei ICYMI Health law enrollment extensions will go through April 15  http//onwsjcom/1loX8a5
451714936994271232|Thu Apr 03 133648 0000 2014|RT jonkamp Dispute over a Lyme disease treatment draws in some state legislatures http//onwsjcom/1i35IH7
451589811988488193|Thu Apr 03 051935 0000 2014|Medicare to Publish Trove of Data on Doctors http//onwsjcom/1lp8OcR
451589810897965056|Thu Apr 03 051935 0000 2014|Glaxo Suffers Another Setback http//onwsjcom/1lp8OcP
451552145880272896|Thu Apr 03 024955 0000 2014|Lyme Disease Dispute Draws in State Legislatures http//onwsjcom/1sajxvC
451520675434356736|Thu Apr 03 004452 0000 2014|Jindal Lays Out Alternative to HealthCare Law http//onwsjcom/1pQae1Q
451441842069192704|Wed Apr 02 193137 0000 2014|RT stefaniei Anesthesiologists on top Highest average salary of any profession according to latest DOL wage data $235070/year http/
451408349742247937|Wed Apr 02 171832 0000 2014|RT stefaniei MustSee WSJ TV Melinda Beck and Dr Nancy Keating discuss pros and cons of screening mammograms http//onwsjcom/PdCyhr
451399119924645888|Wed Apr 02 164151 0000 2014|RT stefaniei Wth all the studies questioning breastcancer screening should women stop getting mammograms Q&amp;A via MelindaBeckWSJ http/
451373458870792192|Wed Apr 02 145953 0000 2014|RT JeanneWhalen Remember all the illegal Avastin  some of it fake  that appeared in US  US says much came from this Turkish firm htt
451369880923955200|Wed Apr 02 144540 0000 2014|RT stefaniei 5 Things What we dont yet know about the 7 million health law enrollees cdweaver http//muswsjcom/fivethings/BL263B500
451369315322036225|Wed Apr 02 144325 0000 2014|RT louiseradnofsky Marylands current IT platform has serious defects State to scrap rebuild troubled exchange via corbettdooren htt
451355057335074817|Wed Apr 02 134646 0000 2014|RT stefaniei Faces of the ACA Read updates on our profile subjects http//onwsjcom/N7dK9F And share your own story here http//tco/tw
451345370510290944|Wed Apr 02 130816 0000 2014|RT JeanneWhalen Drug companies pay loads of academic physicians $300000/yr to sit on boards Conflict of interest by edsilverman http
451345038220722176|Wed Apr 02 130657 0000 2014|RT LauraLandroWSJ 5 Questions About Obamacare’s 7 Million Enrollees by cdweaver  http//blogswsjcom/fivethings/2014/04/01/5questionsabouttheobamacares7millionenrollees/ via WSJ
451344531284590592|Wed Apr 02 130456 0000 2014|RT TomBurtonWSJ Medical whiplash Is coconut oil once a bad fat now good for you In mice at least WSJ http//onlinewsjcom/news/articles/SB10001424052702304418404579469762543729116modtrendingnow4
451344377517203456|Wed Apr 02 130419 0000 2014|RT stefaniei Yet another study concludes screening mammograms lead to overtreatment But how to decide which cancers to not treat http/
451210173994893313|Wed Apr 02 041103 0000 2014|White House Meets HealthLaw Goal http//onwsjcom/1gMTGWh
451210172392681472|Wed Apr 02 041102 0000 2014|Intuitive Surgicals Robotic System Gets FDA OK http//onwsjcom/1iYr1gr
451117151290916864|Tue Apr 01 220124 0000 2014|RT annawmathews See updates on our healthlaw profile subjects as they face big choices http//graphicswsjcom/HealthProfiles/ healthcare via WSJGraphi
451117098279141376|Tue Apr 01 220112 0000 2014|RT betswrites 65 million Americans have chronic heart failure; rehab programs help them live longer better lives ronwinslow http//t
451068141142294528|Tue Apr 01 184639 0000 2014|RT janetadamy WH says enrollment hits 7 million http//onwsjcom/QCrE6h
451047785786531840|Tue Apr 01 172546 0000 2014|RT stefaniei Faces of the ACA A doctor sees a surge in interest in new health coverage among his patients as the deadline loomed http/
451047620417699841|Tue Apr 01 172507 0000 2014|RT stefaniei Faces of the ACA A skeptic of the health law replaces his canceled insurance  with a pricier policy http//tco/25O7GOEs
451047524301041665|Tue Apr 01 172444 0000 2014|RT stefaniei Faces of the ACA One Young Invincible takes a pass on health insurance this year Read our ongoing coverage http//tco/
451018592503726080|Tue Apr 01 152946 0000 2014|RT JeanneWhalen First Congress criticized Gileads hepatitis C pill for $1000/day price Now insurers complaining jonathanrockoff http
451014234722533377|Tue Apr 01 151227 0000 2014|RT joecwalker Intuitive Surgical shares jump after FDA OK for its new robotic system $ISRG http//onwsjcom/1s2x7kD
451007711132794880|Tue Apr 01 144632 0000 2014|RT stefaniei Faces of the ACA People faced decisions and change as laws deadline approached Our skeptics story and more http//tc
450995123820969984|Tue Apr 01 135631 0000 2014|RT TimJHanrahan The ACA deadline passed (sort of) but political fight is far from over WSJs carolelee on the state of play  http/
450989497447383040|Tue Apr 01 133409 0000 2014|RT LauraLandroWSJ My Informed Patient column today in WSJ Patient heal thyself What your activation score tells your doctor http/
450985944204976128|Tue Apr 01 132002 0000 2014|RT stefaniei Gileads Sovaldi shaping up to be a big hit with patients but a different kind of hit to insurers jonathanrockoff  http/
450984872837128193|Tue Apr 01 131547 0000 2014|RT stefaniei On the (sorta) final day of health law enrollment big surge in interest but also big technical woesagain  http//tco/c7
450984652799737856|Tue Apr 01 131454 0000 2014|RT TomBurtonWSJ If the FDA approves only metoo antibiotics how will US and world solve drugresistant infections WSJ http//tco/ds
450984490715074560|Tue Apr 01 131416 0000 2014|RT Loftus Some breathing room for Lilly Judge upholds validity of key US patent for Eli Lillys lungcancer drug Alimta http//tco/fcl
450859929423728640|Tue Apr 01 045918 0000 2014|New Technical Woes Hobble Health SignUps at Zero Hour http//onwsjcom/1dMnfrd
450859927825698817|Tue Apr 01 045918 0000 2014|The Path to a Stronger Heart http//onwsjcom/1dMncvH
450859927045558273|Tue Apr 01 045917 0000 2014|New Zealand Mayor Relies on Pedal Power http//onwsjcom/1km4c5G
450756531689365504|Mon Mar 31 220826 0000 2014|RT stefaniei Tevas fight to protect its brandname rainmaker Copaxone heads to the Supreme Court http//onwsjcom/1fHCOfp via jonathanr
450734500776247296|Mon Mar 31 204053 0000 2014|RT cdweaver For the playbyplay on http//HCgovs tech troubles today refer to our 3/14 story http//onlinewsjcom/news/articles/SB10001424052702303546204579439633528430154mgreno64wsj via Sp
450682410515324929|Mon Mar 31 171354 0000 2014|RT louiseradnofsky New http//Healthcaregov glitch hitting site around 12pm ET prevents users from creating new accounts http//tco/Nm
450677843442544640|Mon Mar 31 165545 0000 2014|RT CorbettDooren Joe Biden Talks Obamacare Skin Care on Rachael Ray http//onwsjcom/1fGGAp7 via WSJwashington
450665002106912769|Mon Mar 31 160444 0000 2014|RT stefaniei 5 Things to know about todays health law deadline Thing 5 You can still buy coverage when your situation changes http/
450648593444380672|Mon Mar 31 145931 0000 2014|RT louiseradnofsky Software bug takes down Health Care Site as potential enrollees face Monday deadline http//onwsjcom/1hrKVR0
450648533348409344|Mon Mar 31 145917 0000 2014|RT janetadamy White House clock gets health signup countdown wrong via jaredfavole http//onwsjcom/1jryFAO
450632043370930176|Mon Mar 31 135346 0000 2014|RT janetadamy Penalty for not having insurance starts tomorrow Five things you need to know about it http//blogswsjcom/fivethings/2014/03/29/5thingstoknowaboutthehealthlawspenalty/
450631729766989825|Mon Mar 31 135231 0000 2014|RT janetadamy Bring your folding chair if youre heading out to enroll in insurance today The waits have been long http//tco/LZiOlwKL
450630299790368768|Mon Mar 31 134650 0000 2014|RT jonathanrockoff Carlyle to buy J&amp;Js orthoclinical diagnostics business for $4bn http//onwsjcom/1hbbqFU $JNJ $CG
450629839075434496|Mon Mar 31 134500 0000 2014|RT stefaniei Experimental antibiotics could be test of FDA effort to speed certain drugs through review TomBurtonWSJ  http//tco/EWdU7
450629360438235136|Mon Mar 31 134306 0000 2014|RT Loftus New class of cholesterol drugs shown effective in studies http//onwsjcom/1h8nCXW  PCSK9 roundup from ronwinslow $AMGN $REGN
450629115625103362|Mon Mar 31 134208 0000 2014|RT TomBurtonWSJ Medtronic persists with research on renal denervation for high blood pressure  despite bad results WSJ  http//tco
450628931180576770|Mon Mar 31 134124 0000 2014|RT stefaniei Long waits as people lined up for help with last minute health insurance signup louiseradnofsky CorbettDooren  http//tc
450485269532516353|Mon Mar 31 041032 0000 2014|New Cholesterol Drugs Shown Effective in Studies http//onwsjcom/1kf6PX9
450485268441620480|Mon Mar 31 041032 0000 2014|Long Waits as Health Deadline Nears http//onwsjcom/1dIIXMK
450344572837953537|Sun Mar 30 185127 0000 2014|RT LauraLandroWSJ Newborns need healthinsurance too If parents have separate coverage weigh which is better for baby  WSJ Sunday  ht
450325559009370113|Sun Mar 30 173554 0000 2014|RT joecwalker  Ronwinslow s report on the new cholesterol drugs that have drawn standing room crowds at ACC14 http//tco/r7vaQyZiy
