494153505335414784|Tue Jul 29 161231 0000 2014|RT stefaniei No new sunscreen ingredients have been OKed in 15 yrs so Congress steps in with bill requiring FDA to speed approval http/
494153183045120000|Tue Jul 29 161114 0000 2014|RT pharmalot Do prescription drug prices worry you Join us to discuss w/USCs danagoldmanphd tonight at 8 pm ET http//onwsjcom/WESaP7
494147146384687104|Tue Jul 29 154715 0000 2014|RT WSJThinkTank What if Medicare spending has slowed for a reason other than Obamacare http//onwsjcom/1rBvnwY via JohnFeehery http//t
494125462793502722|Tue Jul 29 142105 0000 2014|RT stefaniei Scientists study how to nudge the public into better behavior  like orderly airplane boarding http//onwsjcom/1Arsyob sh
494124944956346368|Tue Jul 29 141901 0000 2014|RT TomBurtonWSJ Liberia closes borders as worst Ebola outbreak continues apace in 3 African nations WSJ DrewHinshaw betswrites  http
494119186734788609|Tue Jul 29 135609 0000 2014|RT stefaniei NYC restaurants try artsy versions of the choking poster Can you still tell its the Heimlichhttp//onwsjcom/1teTci0 http/
494117462670315520|Tue Jul 29 134918 0000 2014|RT rddysum Move over Zumba here comes Disq  http//onwsjcom/1ArsOUo via WSJ
494115219254562816|Tue Jul 29 134023 0000 2014|RT MPhillipsWSJ Congressional negotiators agree to stop evicting braininjured veterans from VA rehab http//onwsjcom/1uACETh http//t
494115069484359680|Tue Jul 29 133947 0000 2014|When will social security and medicare run out New report gives Medicare a longer life http//onwsjcom/1nTuVul
494107647348862976|Tue Jul 29 131018 0000 2014|RT stefaniei Is there an upside to morning sickness Maybe healthier babies http//onwsjcom/1tiaLhb
494106458569846784|Tue Jul 29 130534 0000 2014|RT WSJRadio Research shows we can nudge people to do the right thing ShirleySWangWSJ and GordonDeal discuss   http//onmktwnet/UI7KYp 
494105933803692032|Tue Jul 29 130329 0000 2014|RT stefaniei Court ruling discouraging doctors from asking about guns sparks concerns http//onwsjcom/1rTXERm
494105747543035904|Tue Jul 29 130244 0000 2014|RT pharmalot Pharmalot Pharmalittle Good Morning cool breezes &amp; hot headlines http//blogswsjcom/pharmalot/2014/07/29/pharmalotpharmalittlewerereadingaboutglaxomannkindandlotsmore/ pharma $GSK $MNKD cholesterol
494068712907882497|Tue Jul 29 103535 0000 2014|Medicare Social Security Disability Fund Headed in Different Directions http//onwsjcom/1nX2xYh
493955173476077568|Tue Jul 29 030425 0000 2014|Lawmakers Unveil $17 Billion Fix for VA http//onwsjcom/1qdEgvV
493955172716920832|Tue Jul 29 030425 0000 2014|House Passes Bill to Speed FDAs Sunscreen Approvals http//onwsjcom/1qdEgvQ
493955172154892289|Tue Jul 29 030424 0000 2014|West Africa Strains to Contain Ebola http//onwsjcom/X7hdug
493937720150876160|Tue Jul 29 015504 0000 2014|In Tests Scientists Try to Change Behaviors http//onwsjcom/1xrURP5
493937719328792576|Tue Jul 29 015503 0000 2014|Reckitt to Spin Off Pharma Unit http//onwsjcom/1xrUTq6
493937718011772928|Tue Jul 29 015503 0000 2014|Targacept to Discontinue Overactive Bladder Program http//onwsjcom/1nUTbMB
493857382372372481|Mon Jul 28 203550 0000 2014|RT pharmalot AstraZeneca battles doctors over preemie drug guidelines read them here see the ad campaign http//blogswsjcom/pharmalot/2014/07/28/astrazenecabattlespediatriciangroupoverpreemiedrugguidelines/ pharm
493841464934563840|Mon Jul 28 193235 0000 2014|RT stefaniei Docs seek more information from CMS abut the context surrounding Sunshine Act payment disclosures http//onwsjcom/1qHkOfQ vi
493801069194252288|Mon Jul 28 165203 0000 2014|RT stefaniei Stilltrustees say health costs and aging pop will eventually drain Medicare reserves unless Congress intervenes http//
493801028199133184|Mon Jul 28 165154 0000 2014|RT stefaniei Trustees report Medicare trust fund rebounding; will be able to pay full benefits until 2030 http//onwsjcom/1zmyLQU via d
493799427048742912|Mon Jul 28 164532 0000 2014|RT damianpaletta Medicare covered 12 million MORE people in 2013 vs 2012 but spent $900 million LESS on their hospital benefits
493798803598999553|Mon Jul 28 164303 0000 2014|RT pharmalot Do prescription drug prices worry you Join us to discuss w/USC danagoldmanphd at 7/29 at 8 pm ET http//onwsjcom/WESaP7 
493765434882400257|Mon Jul 28 143028 0000 2014|RT JeanneWhalen FBI agents have been interviewing Glaxo employees as part of a probe into companys China business http//tco/Hdh3t0iHA
493756821627498496|Mon Jul 28 135614 0000 2014|At noon the government will publish its annual social security and Medicare report Four things to watch for http//onwsjcom/1o5TWy8
493747916667101184|Mon Jul 28 132051 0000 2014|RT LauraLandroWSJ Crunching the  numbers on whether  morcellators worth risk for gyn cancer surgery Bottom line no mcjomcg http//tc
493747681765097472|Mon Jul 28 131955 0000 2014|RT stefaniei Medicare and Social Security Report 4 Things to Watch http//onwsjcom/1o5TWy8 via WSJPolitics
493746381476352000|Mon Jul 28 131445 0000 2014|RT pharmalot Hospira eyes a tax inversion http//blogswsjcom/pharmalot/2014/07/28/pharmalotpharmalittlewerereadingabouthospiraranbaxyfedexandmuchmore/ pharma $HSP US Sen Durbin will be mad  http//blogswsjcom/pharmalot/2014/07/23/durbinharshlycriticizeswalgreenfortaxinversionplans/ $ABBV $
493745578191642624|Mon Jul 28 131133 0000 2014|RT stefaniei Wave of newly insured patients under the health law helps boost hospitals earnings    cdweaver http//onwsjcom/1rCGdoi
493745502782246913|Mon Jul 28 131115 0000 2014|RT pharmalot Pharmalot Pharmalittle Good Morning welcome to the working week http//blogswsjcom/pharmalot/2014/07/28/pharmalotpharmalittlewerereadingabouthospiraranbaxyfedexandmuchmore/ pharma $HSP $JNJ $NVS $FDX ta
493594205906669568|Mon Jul 28 031003 0000 2014|Hospira Bidding for Danone MedicalNutrition Unit http//onwsjcom/1q6YhUP
492869918828683266|Sat Jul 26 031200 0000 2014|States Try to Protect Health Exchanges From Ruling http//onwsjcom/1pVTZ2j
492783383563345920|Fri Jul 25 212808 0000 2014|RT louiseradnofsky Tim Jost weighs in with defense of Jon Grubers health law tax credits speeches Updated post http//onwsjcom/1unFOKc v
492717056094380032|Fri Jul 25 170435 0000 2014|RT stefaniei Anxious traders Robert M Sapolsky looks at stress hormones and the market http//onwsjcom/1ryxC6e
492715516956774400|Fri Jul 25 165828 0000 2014|RT jonathanrockoff theres a whole lot of craziness going on at sarepta sounds like joewalkerWSJ is on it here http//onwsjcom/1t0DxTB
492715376506331137|Fri Jul 25 165754 0000 2014|RT LauraLandroWSJ New kind lof search engine Google collecting data to create picture a healthy human body  alistairmbarr http//tco/q
492715274123362304|Fri Jul 25 165730 0000 2014|RT stefaniei Meet the South Carolina attorney who helped spark this weeks Affordable Care Act rulings http//onwsjcom/1rzv6g7 stephaniea
492711937718112257|Fri Jul 25 164414 0000 2014|RT pharmalot Pharmalot Pharmalittle The Weekend Nears headlines &amp; daydreams http//blogswsjcom/pharmalot/2014/07/25/pharmalotpharmalittletheweekendnearswerereadingaboutoxycontinhpvandmuchmore/ pharma $SRPT $AMGN $GSK $JNJ HP
492711825642098688|Fri Jul 25 164348 0000 2014|RT pharmalot Up and Down the Ladder; the latest comings &amp; goings recognize anyone http//blogswsjcom/pharmalot/2014/07/25/upanddowntheladderthelatestcomingsandgoingsatcovancebristoland/ pharma $CVD $BMY $ARNI phar
492683399799115777|Fri Jul 25 145050 0000 2014|RT louiseradnofsky Obama administration releases forms for employers to report health coverage to IRS spikes talk of more mandate delay 
492481487216717824|Fri Jul 25 012831 0000 2014|Chief Scientist Is Out at Biotech http//onwsjcom/1nyNsMp
492481486587564032|Fri Jul 25 012830 0000 2014|Glaxo Files Its Entry in Race for a Malaria Vaccine http//onwsjcom/1x96J8F
492481485874544640|Fri Jul 25 012830 0000 2014|Universal Health Services Profit Falls http//onwsjcom/1nyNrba
492481484607852545|Fri Jul 25 012830 0000 2014|VA Talks at Impasse in Congress http//onwsjcom/1x96J8y
492481483903221760|Fri Jul 25 012830 0000 2014|Gentiva in Nondisclosure Pact With Suitor http//onwsjcom/1x96JWa
492398568465252352|Thu Jul 24 195901 0000 2014|RT Loftus Qui tam lawsuits played role in most of $123B recovered by US in healthcare fraud settlements from 200913 http//tco/cPD9hZ
492379727232266240|Thu Jul 24 184409 0000 2014|RT JeanneWhalen New hepatitis C pill is vaulting Gilead into the industrys big leagues  and boosting scrutiny of its pricing http//t
492352195829202944|Thu Jul 24 165445 0000 2014|RT betswrites CDC lab chief resigns in wake of anthrax scare Our take  http//onwsjcom/1sSnaZ4 via WSJ
492323285980704768|Thu Jul 24 145952 0000 2014|RT stefaniei If Valeant buys Allergan many docs would consider shifting their business Sanford Bernstein survey http//onwsjcom/1nEjaJD
492319787473981440|Thu Jul 24 144558 0000 2014|RT stefaniei Thinking of becoming a whistleblower A look at how the False Claims Act and qui tam lawsuits work http//onwsjcom/1o1CQpWmodbrieflysharetwt v
492314385667596288|Thu Jul 24 142430 0000 2014|RT louiseradnofsky Key question on healthlaw subsidies Were plaintiffs harmed by the governments action http//onwsjcom/1sU8Oaw via b
492306105360736256|Thu Jul 24 135136 0000 2014|RT jenniferlevitz Boston Marathon survivors still suffer from hearing loss and frustrating ringing in ears My story today http//tco/NC
492305516262359040|Thu Jul 24 134916 0000 2014|RT joewalkerWSJ In todays WSJ jonathanrockoff calls it Gilead now one of pharmas most powerful cos $GILD up 1% premarket http//t
492305042335367168|Thu Jul 24 134723 0000 2014|RT Loftus At least 25 people or groups have filed 5 or more False Claims Act lawsuits alleging fraud since late 80s http//tco/cPD9hZJ
492304930460692481|Thu Jul 24 134656 0000 2014|RT stefaniei How serial whistleblowers help the govt recover millions from pharma and help themselves as well Loftus http//tco/L
492304794162577408|Thu Jul 24 134624 0000 2014|RT pharmalot Pharmalot Pharmalittle Good Morning another sunny day http//blogswsjcom/pharmalot/2014/07/24/pharmalotpharmalittlewerereadingaboutgileadtevaandlotsmore/ pharma $GILD $TEVA $NVS $GSK biosimil
492142068018327554|Thu Jul 24 025947 0000 2014|How a Louisiana Doctor Got Rich Invoking AntiFraud Law http//onwsjcom/1lxCK4M
492124868368805888|Thu Jul 24 015126 0000 2014|Key Question on HealthLaw Subsidies Were Plaintiffs Harmed http//onwsjcom/1x3MjO4
492124867496398848|Thu Jul 24 015126 0000 2014|Hepatitis C Pill Rockets Gilead Into Big Leagues http//onwsjcom/1x3MlFY
492124866619772928|Thu Jul 24 015126 0000 2014|Surgical Robot Fails to Show Advantages http//onwsjcom/1nsW1bI
492057448619200512|Wed Jul 23 212332 0000 2014|RT joewalkerWSJ Intuitive Surgicals robot about the same as open surgery for treating bladder cancer in Sloan Kettering study http//tc
492057276610777088|Wed Jul 23 212251 0000 2014|RT wisnefski Gileads HepC drug generates $35B in 2Q salesextending bestever launch of prescription drug http//onwsjcom/1sT8pW1 http/
492054410902925312|Wed Jul 23 211128 0000 2014|RT jonathanrockoff Some big top $TEVA investors voting against reelection of certain directors unhappy with board makeover  http//tc
492029373240074240|Wed Jul 23 193158 0000 2014|RT stefaniei The surge in nohuddle offense is having an impact on NFL referees They have to get into shape http//onwsjcom/1sSbkOw
492029158642679808|Wed Jul 23 193107 0000 2014|RT pharmalot Why a trial for a Vertex cystic fibrosis drug combo sent mixed signals http//blogswsjcom/pharmalot/2014/07/23/whyatrialforavertexcysticfibrosisdrugcombosentmixedsignals/ pharma $VRTX cysticfibrosis
492024530173706241|Wed Jul 23 191244 0000 2014|RT TomBurtonWSJ Drugsafety experts say blood tests of Pradaxa patients  and a lower dose  could minimize dangerous bleeds WSJ htt
491939722852569089|Wed Jul 23 133544 0000 2014|RT stefaniei Insurers will move ahead with plans to offer policies on the exchanges regardless of confusion over subsidy rulings http/
491939520213159936|Wed Jul 23 133456 0000 2014|RT JeanneWhalen Turkish citizen pleads guilty to smuggling counterfeit and nonFDAapproved cancer drugs into the US http//tco/b8gkXH
491934005177364480|Wed Jul 23 131301 0000 2014|RT LauraLandroWSJ Battle for Breakfast fast food chains groceries offer protein cereal slips juliejargon anniegasparro  http//tco
491932417985622016|Wed Jul 23 130642 0000 2014|RT stefaniei A shirt to help improve your posture Its a thing http//onwsjcom/1lnyd4P
491932358191624192|Wed Jul 23 130628 0000 2014|RT pharmalot Pharmalot Pharmalittle Good Morning headlines &amp; deadlines and coffee too http//blogswsjcom/pharmalot/2014/07/23/pharmalotpharmalittlewerereadingaboutcelgenecounterfeitmedsandmuchmore/ pharma $CELG count
491775707794509824|Wed Jul 23 024400 0000 2014|New Light on Cancer Risk From Hysterectomy Device http//onwsjcom/1lsV66Q
491775707031552000|Wed Jul 23 024359 0000 2014|VA Nominee Gets Warm Reception at Confirmation Hearing http//onwsjcom/1lsV66P
491766063420276737|Wed Jul 23 020540 0000 2014|Obama Administration to Revise Part of Contraception Rule http//onwsjcom/1lsObuw
491764103716020224|Wed Jul 23 015753 0000 2014|RT janetadamy Obama administration will revise contraception compromise for nonprofit employer health plans louiseradnofsky http//tco
491758288711598080|Wed Jul 23 013447 0000 2014|Courts Issue Conflicting Rulings on HealthLaw Subsidies http//onwsjcom/1lsJlxc
491758288099233792|Wed Jul 23 013446 0000 2014|Turkish Man Admits to Smuggling Fake Cancer Drugs http//onwsjcom/1nlfOtk
491707075706499073|Tue Jul 22 221117 0000 2014|RT betswrites Undetected uterine cancers are more common than thought jenniferlevitz http//onwsjcom/1p7viOI via wsjnumbers
491679857718222848|Tue Jul 22 202307 0000 2014|RT annawmathews So what just happened On the dueling appealscourt rulings http//onwsjcom/1yW4iZV via WSJ
491644180087980032|Tue Jul 22 180121 0000 2014|RT louiseradnofsky In Case Youre Busy Court Rulings on HealthLaw Subsidies At A Glance http//onwsjcom/1p73pX2modbrieflysharetwt via WSJ
491636469774446592|Tue Jul 22 173043 0000 2014|RT louiseradnofsky Percentage of enrollees with tax credits in each of the 36 states affected by the health law decision today http//t
491628434800775168|Tue Jul 22 165847 0000 2014|RT TomBurtonWSJ Duelling federal court decisions on whether Obamacare subsidies stand in states w/o state exchanges WSJ  http//tco/t
491627279983050754|Tue Jul 22 165412 0000 2014|RT stefaniei Is a board exam every 10 years enough to show doctors are up to date Many specialists say yes and MOC is a waste http//
491611782067531777|Tue Jul 22 155237 0000 2014|RT louiseradnofsky How the health law case about tax credits for people using federallyrun exchanges began back in September 2012 http
491607537704529921|Tue Jul 22 153545 0000 2014|RT louiseradnofsky Keep checking WSJ for our growing story on the implications of the latest court decision on the federal health law ht
491602947378515968|Tue Jul 22 151730 0000 2014|RT betswrites JAMA Morcellator even riskier than than thought 1 in 368 women at risk  may spread more cancers jenniferlevitz http/
491600345676537856|Tue Jul 22 150710 0000 2014|RT cdweaver And so Obamacare reporting returns to the subjunctive mood after a two year grammatical hiatus http//onlinewsjcom/articles/keysectionofhealthcarelawstruckdownbyappealscourt1406039685
491595645346516992|Tue Jul 22 144830 0000 2014|RT TimJHanrahan The blue states are the federally run exchanges which are impacted by todays ruling Story http//onwsjcom/1yW4iZV http
491595532842700802|Tue Jul 22 144803 0000 2014|RT WSJPolitics First take of WSJ story on important healthlaw subsidies ruling http//onwsjcom/1yW4iZV by brkend
491594510401806337|Tue Jul 22 144359 0000 2014|RT stefaniei Heres the story Federal appeals court strikes down healthlaw subsidies administered via federally run exchange http//t
491592343083307008|Tue Jul 22 143522 0000 2014|RT janetadamy US Appeals Court Strikes Down Some HealthLaw Insurance Subsidies Story coming on http//wsjcom
491583811856375808|Tue Jul 22 140128 0000 2014|RT rddysum Kids are $$$$$ Baby on the way Heres what you can expect to spend http//onwsjcom/1sAW5th via WSJ
491581692533297152|Tue Jul 22 135303 0000 2014|RT ShirleySWangWSJ The perfect amount of sleep Seven hrs linked with lowest mortality and morbidity reports rddysum http//tco/Lh7nF3
491581264936189954|Tue Jul 22 135121 0000 2014|RT stefaniei Perception of time is a psychological filter lehotz explains why those with more power feel they have more time http//
491574956137144321|Tue Jul 22 132617 0000 2014|RT stefaniei Big study from working group highlights genes role in schizophrenia http//onwsjcom/1sI6eo0 ShirleySWangWSJ
491571261190180865|Tue Jul 22 131136 0000 2014|RT LauraLandroWSJ Whats Your Workout in WSJ Rob Davis of Jordan Winery uses endurance races to train for the wine harvest http//tco/
491570212719067137|Tue Jul 22 130726 0000 2014|RT stefaniei Doctors push back agains MOC requirements for board certification calling them costly irrelevant Melindabeckwsj http/
491569979683516416|Tue Jul 22 130630 0000 2014|RT joewalkerWSJ Allergans takes a page from Valeants playbook in effort stay independent http//onlinewsjcom/articles/valeanttakesallergancomplaintstoregulators1405942770 $AGN $VRX
491569881947865088|Tue Jul 22 130607 0000 2014|RT pharmalot Pharmalot Pharmalittle Good Morning sunshine coffee &amp; headlines http//blogswsjcom/pharmalot/2014/07/22/pharmalotpharmalittlewerereadingabouttaxinversionsallerganandlotsmore/ pharma $AGN $VRX taxinversion
491399655721160704|Tue Jul 22 014942 0000 2014|Allergan to Cut 13% of Workforce http//onwsjcom/1tsJ5U4
491399655142338560|Tue Jul 22 014942 0000 2014|Doctors Upset Over Skill Reviews http//onwsjcom/1tsJ5DH
491331189777903616|Mon Jul 21 211738 0000 2014|RT Loftus Synergy never sounded so trippy Weird Al Yankovic alyankovic in Mission Statement (Exclusive) http//onwsjcom/1yDC8mb via 
491313455476248576|Mon Jul 21 200710 0000 2014|RT stefaniei MustSee WSJ TV lauralandroWSJ on how hospitals are addressing their busynurse problem http//livewsjcom/video/fixinghospitalsbusynurseproblem/85710E3C232A48E1902CB59236EADA5Dhtml
491302397227311104|Mon Jul 21 192314 0000 2014|RT pharmalot FDA spars with recalcitrant compounding pharmacy again will 3rd time be the charm http//blogswsjcom/pharmalot/2014/07/21/fdasparswithrecalcitrantcompoundingpharmacyagain/ pharma FDA c
491293355016740864|Mon Jul 21 184718 0000 2014|RT stefaniei Study finds elementary students ultimately like new healthier lunches (after first heartily complaining) http//tco/uDL3rt
491217080327630849|Mon Jul 21 134413 0000 2014|RT LauraLandroWSJ Shoppers zeal for healthier foods and beverages like soy dents profits of Americas largest milk processor http//tc
491216738261139456|Mon Jul 21 134251 0000 2014|RT stefaniei They said they would be costcutting Allergan to cut 13% of work force $VRX $AGN http//onwsjcom/1yPCvKn
491215978349735936|Mon Jul 21 133950 0000 2014|RT betswrites AIDS2014 conference opens in Melbourne with tears and tributes MH17 http//onwsjcom/1n0Wz94
491215624140771328|Mon Jul 21 133825 0000 2014|RT Loftus In HepC patent lawsuits AbbVie and Gilead trade barbs you dont often hear their execs say in public http//onwsjcom/1psRnsE v
491214182717870080|Mon Jul 21 133242 0000 2014|RT pharmalot Pharmalot Pharmalittle Good Morning coffee &amp; headlines http//blogswsjcom/pharmalot/2014/07/21/pharmalotpharmalittlewerereadingaboutvaleantgileadandlotsmore/ pharma $AGN $VRX $GSK $JNJ $PFE $AZN $G
491214082717261824|Mon Jul 21 133218 0000 2014|RT Loftus In HepC patent battle Merck came to Gilead with an offer that Gilead could and did refuse http//onwsjcom/1psRnsE via W
491214031857143808|Mon Jul 21 133206 0000 2014|RT stefaniei Drug makers tussle over patents in a bid for a piece of the Sovaldi pie Loftus explains the frenzy in hep C market http/
491072801143414785|Mon Jul 21 041054 0000 2014|Big Allergan Investor Sells Most of Stake http//onwsjcom/1rh9BAv
491022901475164161|Mon Jul 21 005237 0000 2014|Lucrative Drug Niche Sparks Legal Scramble http//onwsjcom/1rgKxcX
490147738575994881|Fri Jul 18 145502 0000 2014|RT stefaniei Oregon to Pharma Let’s make a deal on hepatitis c drugs http//onwsjcom/1nfVFqh via JoewalkerWSJ on pharmalot
490147570589913088|Fri Jul 18 145422 0000 2014|RT betswrites Tragedy repeats itself w/ AIDS2014 attendees lost on MH17 AIDS pioneer Jonathan Mann died in Swissair crash http//tc
490123566202253312|Fri Jul 18 131858 0000 2014|RT LauraLandroWSJ Health plans that stop contraceptive coverage after Hobby Lobby ruling must disclose change stepharmour1 http//tco/G
490121635945385985|Fri Jul 18 131118 0000 2014|RT betswrites Deepest condolences to friends  family of Joep Lange Glenn Thomas and others on MH17 enroute to AIDS2014 http//tco/q
490121427186909184|Fri Jul 18 131028 0000 2014|RT betswrites Senseless  tragic MH17 victims include researchers activists enroute to AIDS2014 conference in Melbourne http//tco/
490121243757387777|Fri Jul 18 130945 0000 2014|RT stefaniei AbbVie and Shire are doing it Big breakup fee $16 billion  if it doesnt work out http//onwsjcom/1swyCt8 hesterplumri
490121228519485440|Fri Jul 18 130941 0000 2014|RT pharmalot Up and down the ladder jobs changes the latest comings &amp; goings recognize anyone http//blogswsjcom/pharmalot/2014/07/18/upanddowntheladderthelatestcomingsandgoingsatbayeraptuitand/ pharma $ACAD 
490119567319265280|Fri Jul 18 130305 0000 2014|RT pharmalot Pharmalot Pharmalittle The Weekend Nears headlines &amp; daydreams http//blogswsjcom/pharmalot/2014/07/18/pharmalotpharmalittleastheweekendnearswerereadingaboutabbviefedexandsomuchmore/ pharma $ABBV $SHPG $GSK $AMGN $FD
489990722699788288|Fri Jul 18 043106 0000 2014|FedEx Indicted in Prescription Drug Probe http//onwsjcom/1svNbxd
489971867629801473|Fri Jul 18 031611 0000 2014|China Allows Open Trial for Glaxo Investigators http//onwsjcom/1wCclb0
489971866954498048|Fri Jul 18 031610 0000 2014|AIDS Researchers Among Those Feared Dead in Malaysia Flight Crash http//onwsjcom/1nRlxYw
489944308850495488|Fri Jul 18 012640 0000 2014|Health Plans Must Disclose Changes to Contraceptive Coverage http//onwsjcom/1wBUd13
489843609127374850|Thu Jul 17 184631 0000 2014|RT WSJ Japanese pitchers throw hundreds of balls at full force daily risking serious injury http//onwsjcom/1t5SalQ http//pbstwimgcom/media/BstwqiQIQAAPTMJjpg
489843281766129664|Thu Jul 17 184513 0000 2014|RT laurenweberWSJ In fiscal 2013 Florida topped the list for number of complaints of pregnancy discrimination http//onwsjcom/1nPxKgp w
489809356092080128|Thu Jul 17 163025 0000 2014|RT stefaniei Isaiah Austins diagnosis is boosting  Marfan Syndrome awareness  http//onwsjcom/1wwUan6
489804000242696193|Thu Jul 17 160908 0000 2014|RT betswrites Americas tobacco addiction In WVa 375% of adult smokers puff their first cigarette within 5 minutes of waking up http
489790655019753472|Thu Jul 17 151606 0000 2014|RT JeanneWhalen Express Scripts calls $GILDs pricey hepatitis C drug a tax on all Americans Medicaid prisons footing the bill http
489769706849853441|Thu Jul 17 135252 0000 2014|RT JeanneWhalen We have this mentality that all people have 2 be cured no matter the costits not sustainable by JoeWalkerWSJ http
489767344731090944|Thu Jul 17 134329 0000 2014|RT stefaniei At CDC hearing experts urge slashing the number of labs that can work with anthrax ebola and other dangerous agents http/
489765776812158976|Thu Jul 17 133715 0000 2014|Costly cysticfibrosis drug restricted by Medicaid in Arkansas sparks legal battle http//onwsjcom/1wxlFgv http//pbstwimgcom/media/BsvYOCCMAAGHOjpg
489764912055726080|Thu Jul 17 133349 0000 2014|RT DaveCBenoit Ackman expects to get 25% to call special meeting sometime in mid August But he opens door to settlement Allergan starts
489763789580275712|Thu Jul 17 132921 0000 2014|RT joewalkerWSJ Costs loom large in Arkansas where 3 women w/ cystic fibrosis say Medicaid denied them Vertexs $300k Kalydeco http//tc
489763717975134208|Thu Jul 17 132904 0000 2014|RT pharmalot Johnson &amp; Johnson unit cuts travel costs as it struggles to meet financial goals http//blogswsjcom/pharmalot/2014/07/17/johnsonjohnsonunitcutstravelcoststohitfinancialgoals/ pharma $JNJ depuy
489761654461448192|Thu Jul 17 132052 0000 2014|RT LauraLandroWSJ Aging population with incontinence slowing birthrate has P&amp;G turning to adult diapers SerenaNgWSJ  http//tco/sMCT0z
489759451243905024|Thu Jul 17 131207 0000 2014|RT stefaniei Doc shortage solution in Missouri Let medschool grads without residency training work as assistant physicians http//t
489758991514611712|Thu Jul 17 131017 0000 2014|RT pharmalot Pharmalot Pharmalittle Good Morning sunshine &amp; headlines http//blogswsjcom/pharmalot/2014/07/17/pharmalotpharmalittlewerereadingaboutsanofirocheandlotsmore/ pharma $SNY alzheimers $GSK bribes
489601129471176705|Thu Jul 17 024300 0000 2014|A Costly Drug Is Denied And Medicaid Takes Heat http//onwsjcom/1pbo916
489591103985688576|Thu Jul 17 020310 0000 2014|Gene Therapy Corrects Irregular Heartbeat in Pigs http//onwsjcom/1pbf74l
489591103364927488|Thu Jul 17 020309 0000 2014|Lawmakers Experts Urge Tougher Safety Measures at Government Labs http//onwsjcom/1jzFL9p
489530882752278528|Wed Jul 16 220352 0000 2014|RT bkesling Acting VA secy Gibson testifies before Senate asks for $176 billion in extra funding WSJ  http//onlinewsjcom/articles/vaheadasksforbillionsinnewfundingtofixproblems1405546146KEYWORDSkesling http//
489496576092803072|Wed Jul 16 194732 0000 2014|RT betswrites Lawmakers Experts Urge Tougher Safety Measures at Government Labs say  CDC/USDA shouldnt police themselves http//tco
489495176814264320|Wed Jul 16 194159 0000 2014|RT stefaniei Gene therapy creates a sort of biological pacemaker in pigs hearts that corrects irregular heartbeat http//tco/5XVqMgg
